Url,Title,MRP,Price,Shipping,Seller,Promo,Description,Highlight1,Highlight2,Highlight3,Highlight4,Highlight5,Image1,Image2,Image3,Image4,Image5,Category1,Category2,Category3,Category4,Category5,
"http://www.amazon.in/Apple-iPhone-SE-Gold-64GB/dp/B01DXTSZRO/ref=sr_1_15/260-4410877-3570616?s=electronics&ie=UTF8&qid=1498375553&sr=1-15&keywords=iphone+6","Apple iPhone SE (Gold, 64GB)","49,000.00","27,252.00","FREE Delivery","TECHOHOLIC","NA","Size name:64 GB  |  Colour:GoldFrom the Manufactureriphone SEA big step for small.Welcome to iPhone SE, the most powerful 4‑inch phone ever. To create it, we started with a beloved design, then reinvented it from the inside out. The A9 is the same advanced chip used in iPhone 6s. The 12‑megapixel camera captures incredible photos and 4K videos. And Live Photos bring your images to life. The result is an iPhone that looks small. But lives large.DesignA beloved design. Now with more to love.iPhone SE takes an incredibly popular design and refines it even further. Crafted from bead-blasted aluminium for a satin-like finish, this light and compact phone is designed to fit comfortably in your hand. A brilliant 4‑inch Retina display makes everything look vibrant and sharp. And matt-chamfered edges and a colour-matched stainless steel logo finish the look.App StoreThere’s an app for that.With over one and a half million apps in the App Store, you’ll be able to make your phone your own. Whether you browse by category or search for something specific, quickly discover and download new apps with a tap.Your wish is its command.Siri is your personal assistant, letting you use your voice to send messages, search the web, get guidance on public transport and more. You can even ask Siri to search your photo library to find just the photo or video you’re looking for.CameraThe only camera you’ll ever need.With a 12‑megapixel iSight camera, you can be sure to capture sharp, detailed stills like the ones shot on iPhone 6s. That includes shooting and even editing brilliant 4K video, which is up to four times the resolution of 1080p HD video.Live Photos.Capture more than a moment.Live Photos bring your still photos to life with sound and movement. Simply touch and hold anywhere on your 12‑megapixel still and experience the moments just before and after it was taken, so your photos turn into living memories.FaceTime HD camera with Retina Flash.Your selfie just got more beautiful.The Retina display isn’t just a place to see your content it’s a flash for your FaceTime HD camera. Powered by a custom display chip that allows the display to flash three times brighter than usual, Retina Flash helps illuminate your selfies in low light and at night. And a True Tone flash matches the ambient light for more true-to-life colours and natural-looking skin tones.iCloud Photo Library.All your photos and videos, always with you.iCloud Photo Library stores every photo and video you take, and keeps them up to date on all your devices. Any edits you make are automatically updated everywhere, so you can view a photo from last week or last year no matter where you are.Touch IDAdvanced security. At your fingertip.Touch ID makes unlocking your iPhone SE simple and secure. After all, your fingerprint is the perfect password no two are alike and you always have it with you.WirelessUltra‑fast wireless and Wi‑Fi.Browse the web, download apps, games and stream video over 802.11ac Wi-Fi and ultra‑fast wireless. iPhone SE also supports Wi-Fi calling for high-quality wideband calls. And with Bluetooth technology, you can stay connected to your Apple Watch, external speakers and other devices.TechnologyThe most powerful 4‑inch phone ever.At the core of iPhone SE is the A9, the same advanced chip that’s in iPhone 6s. With 64‑bit desktop-class architecture, the A9 chip brings you spectacular speed and responsiveness. And with console-class graphics performance, your favourite games and apps are incredibly rich and immersive. Making it a mighty chip for maximum performance.Super-efficient M9 motion coprocessor.Embedded directly into the A9 chip, the M9 motion coprocessor connects to the accelerometer, compass and gyroscope for a range of ﬁtness tracking capabilities, such as measuring your steps and distance. It also makes it easy to activate Siri by simply saying “Hey Siri” without having to pick up your iPhone.iOS 9Hardware and software made for each other.With an easy-to-use interface, amazing features and security at its core, iOS 9 is the most advanced mobile operating system and the foundation of iPhone SE. It’s designed to look beautiful and work beautifully on your iPhone, so even the simplest tasks are more fun.Apps that help you do more every day.Your iPhone comes with a collection of essential apps straight out of the box. Messages lets you send texts with photos, videos links and more. Music makes it easy to access the entire Apple Music library along with your personal collection. With FaceTime you can make video calls from your iPhone to someone else’s iPhone, iPad or Mac. And Maps keeps you headed in the right direction.","12‑megapixel camera captures incredible photos and 4K videos, retina flash, ƒ/2.4 aperture, auto HDR for photos, backside illumination sensor, exposure control, improved local tone mapping, face detection, timer mode, burst mode and 1.2MP front facing camera","4-inch (10.16 centimeters) LED-backlit multi-touch capacitive touchscreen with 1136 x 640 pixels resolution and 326 ppi pixel density","iOS v9 operating system with A9 chip 64-bit architecture, embedded M9 motion coprocessor, 2GB RAM, 64GB internal memory and single nano SIM","Built-in rechargeable lithium-ion battery providing talk-time of 14 hours on 3G and standby time of 12 hours on 4g networks, 13 hours on WiFi","1 year manufacturer warranty for device and in-box accessories including batteries from the date of purchase","http://ecx.images-amazon.com/images/I/51-OTudv7cL._SX38_SY50_CR,0,0,38,50_.jpg","http://ecx.images-amazon.com/images/I/31b6hmplzeL._SX38_SY50_CR,0,0,38,50_.jpg","http://ecx.images-amazon.com/images/I/21MeFoqqomL._SX38_SY50_CR,0,0,38,50_.jpg","NA","NA","Electronics","Mobiles & Accessories","Smartphones & Basic Mobiles","Smartphones","NA",
"http://www.amazon.in/Apple-iPhone-7-Black-128GB/dp/B01LXAS8M2/ref=sr_1_16/260-4410877-3570616?s=electronics&ie=UTF8&qid=1498375553&sr=1-16&keywords=iphone+6","Apple iPhone 7 (Black, 128GB)","70,000.00","51,499.00","FREE Delivery","Cloudtail India","NA","NA","12MP primary camera with optical image stabilisation, Quad-LED True Tone flash and Live Photos, 4K video recording at 30 fps and slow-motion video recording in 1080p at 120 fps, 7MP front facing FaceTime HD camera with Retina Flash","4.7-inch (diagonal) Retina HD 3D Touch capacitive touchscreen display and home button with 1334x750 resolution and wide colour, Splash, water and dust resistant","iOS 10 and iCloud operating system with A10 Fusion chip with integrated M10 motion coprocessor, 128GB internal memory and single Nano-SIM","Non-removable Li-Ion 1960 mAh battery (7.45 Wh) providing talktime up to 14 hours on 3G network","1 year manufacturer warranty for device and in-box accessories including batteries from the date of purchase","http://ecx.images-amazon.com/images/I/51odjdfuPTL._SX38_SY50_CR,0,0,38,50_.jpg","http://ecx.images-amazon.com/images/I/31xRVo35ySL._SX38_SY50_CR,0,0,38,50_.jpg","http://ecx.images-amazon.com/images/I/21NQDONXxjL._SX38_SY50_CR,0,0,38,50_.jpg","http://ecx.images-amazon.com/images/I/316B9Q7SFLL._SX38_SY50_CR,0,0,38,50_.jpg","NA","Electronics","Mobiles & Accessories","Smartphones & Basic Mobiles","Smartphones","NA",
"http://www.amazon.in/Apple-iPhone-6s-Silver-32GB/dp/B01LZDA8MU/ref=sr_1_17/260-4410877-3570616?s=electronics&ie=UTF8&qid=1498375553&sr=1-17&keywords=iphone+6","Apple iPhone 6s (Silver, 32GB)","50,000.00","37,390.00","FREE Delivery","TECHOHOLIC","NA","Colour:SilverFrom the ManufacturerA breakthrough design. Pushed even further.iPhone 6s - Take everything that made the previous generation great, and advance it to a new level. They’re made with 7000 Series aluminium, the strongest alloy we’ve ever used in an iPhone. They both feature Retina HD displays made from the strongest cover glass used on any smartphone in the world. And now they’re available in an elegant new rose gold ﬁnish.Sleek and seamless, in four gorgeous ﬁnishes.The smooth, continuous unibody design created for iPhone 6 comes to iPhone 6s. Its familiar form feels just right in your hand. And now there are four stunning ﬁnishes to choose from: gold, silver, space grey, and the new rose gold.The world’s strongest smartphone glass. Now even stronger.The new glass on iPhone 6s is made using a special dual ion‑exchange process, which makes it stronger at a molecular level and the most durable in the smartphone industry.7000 Series aluminium. Stronger from the outside in.The iPhone 6s enclosure is made from the same grade used in the aerospace industry. This aluminium is created from a unique composition of elements that make it the strongest alloy we’ve ever used in an iPhone.They come in Perfect sizes. And perfect.iPhone 6s have stunning Retina HD displays. No matter which size you choose, your apps, photos and just about everything else will look vibrant and sharp. High-contrast, dual-domain pixels, and accurate colours ensure that whatever’s on your screen, you’ll love what you see.3D TouchiPhone 6s was designed specifically to work with 3D Touch, the next generation of Multi-Touch. 3D Touch is a revolutionary pressure‑sensing technology that lets you get to the content you want simply by pressing the display. Capacitive sensors measure the pressure you apply on the glass. You instantly see a response on the screen and feel feedback from the all‑new Taptic Engine. 3D Touch is a perfect example of the magic that happens when hardware and software are designed together. 3D Touch can only perform because it was designed alongside iPhone 6s.Touch IDPlace your ﬁnger on the Home button, and just like that your iPhone unlocks. Touch ID is just as secure as before and now works even faster. You can use it within participating apps to sign in and authenticate purchases.A9 chipThe A9 chip is made speciﬁcally for iPhone. By designing our own chip, we can tailor its performance to how people really use their iPhone. So the things you do every day — browsing the web, using apps, taking photos — work even better. This level of integration between the A9 chip and iOS 9 means that your iPhone performs better and works more eﬃciently than if we used an off-the-shelf chip that we didn’t design.Your iPhone is beautiful. Give it a complement.We take great care in designing every aspect of iPhone 6s, including the cases and accessories. Choose a natural leather case in one of ﬁve colours, or go with vibrant silicone in one of 11 colours. And to keep you charged at home, there are now colour‑matched Apple‑designed metal docks.12MP pictures. 4K videos. Live Photos. Lasting memories.People love to take pictures with iPhone. In fact, it’s the most popular camera in the world. But what people love even more are the memories that are preserved within those images. Those memories are now incredibly vivid with Live Photos, an entirely new way to bring your still photos to life.Lights. 4K camera. Action.The game-winning shot. The impromptu dance party. The first ride without stabilisers. Some things are meant for video. Now you can record those moments in resolution that’s four times higher than HD video. You can zoom in on those 8 million pixels while you’re shooting or playing your 4K videos.Deeply powerful.The innovation begins from within. At every possible opportunity, iPhone 6s has been engineered to work better. More intuitively. And more eﬃciently. iPhone 6s also introduces groundbreaking new technologies, including 3D Touch and Live Photos.64-bit desktop-class architecture.The A9 chip is our third-generation chip with 64-bit architecture. It sits at the cutting edge of mobile chips, improving overall CPU performance by up to 70 per cent compared to the previous generation. And boosting graphics performance by up to a staggering 90 per cent compared to the previous generation.Ultra-fast wireless.Faster Wi‑Fi.iPhone 6s lets you browse the web, download apps and games, and stay connected with the people who matter to you. And with iPhone 6s, you can connect to more networks in more places for even better worldwide roaming. iPhone 6s is also up to twice as fast when you’re connected to Wi‑Fi. And with Bluetooth technology, you’ll stay connected to your Apple Watch, external speakers and hundreds of other devices.*Touch ID. Advanced security.Right at your ﬁngertip.Touch ID lets you unlock your phone simply by using your ﬁngerprint. It uses highly sophisticated algorithms to recognise and securely match your ﬁngerprint. And the improved Touch ID sensor detects your ﬁngerprint even faster than the previous generation.Software and hardware. A deeper connection.If iPhone 6s seems like it’s tailor‑made for iOS, that’s because it is. Each hardware component — from the A9 chip to the Home button — is designed to get the most out of iOS. And likewise, iOS is designed to maximise the performance and functionality of the hardware it runs on. Together, they deliver a powerful and enjoyable experience because they were designed that way — together.The new standard in phone photography comes as standard.iPhone 6s introduces a next-generation, Apple-designed image signal processor to provide better temporal and spatial noise reduction as well as third-generation local tone mapping. Every pixel in the sensor has been re-engineered to prevent crosstalk between the subpixels, meaning we could fit a lot more pixels in the sensor for a sharper photo that has less noise and truer colour. iPhone 6s features optical image stabilisation for videos in addition to photos, so you can get great shots in low light.","12MP primary camera with auto focus, 4K video recording, flash and 5MP front facing camera","11.4 centimeters (4.7-inch) retina HD 3D-touch capacitive touchscreen with 1334 x 750 pixels resolution and 326 ppi pixel density","IOS v10 operating system with 1.84GHz A9 chip 64-bit architecture processor, 2GB RAM, 32GB internal memory and single nano SIM","1715mAH lithium-ion battery providing talk-time of 14 hours on 3G networks and standby time of 240 hours","1 year manufacturer warranty for device and manufacturer warranty for in-box accessories including batteries from the date of purchase","http://ecx.images-amazon.com/images/I/41MAG18py8L._SX38_SY50_CR,0,0,38,50_.jpg","http://ecx.images-amazon.com/images/I/41KU1dZBZ1L._SX38_SY50_CR,0,0,38,50_.jpg","http://ecx.images-amazon.com/images/I/51StTgPBqfL._SX38_SY50_CR,0,0,38,50_.jpg","NA","NA","Electronics","Mobiles & Accessories","Smartphones & Basic Mobiles","Smartphones","NA",
"http://www.amazon.in/Apple-iPhone-SE-Space-Grey/dp/B01DXTSZ4C/ref=sr_1_18/260-4410877-3570616?s=electronics&ie=UTF8&qid=1498375553&sr=1-18&keywords=iphone+6","Apple iPhone SE (Space Grey, 16GB)","39,000.00","20,999.00","FREE Delivery","Cloudtail India","NA","Size name:16 GB  |  Colour:Space GreyProduct Description1 year manufacturer warranty for device and 6 months manufacturer warranty for in-box accessories including batteries from the date of purchaseFrom the Manufactureriphone SEA big step for small.Welcome to iPhone SE, the most powerful 4‑inch phone ever. To create it, we started with a beloved design, then reinvented it from the inside out. The A9 is the same advanced chip used in iPhone 6s. The 12‑megapixel camera captures incredible photos and 4K videos. And Live Photos bring your images to life. The result is an iPhone that looks small. But lives large.DesignA beloved design. Now with more to love.iPhone SE takes an incredibly popular design and refines it even further. Crafted from bead-blasted aluminium for a satin-like finish, this light and compact phone is designed to fit comfortably in your hand. A brilliant 4‑inch Retina display makes everything look vibrant and sharp. And matt-chamfered edges and a colour-matched stainless steel logo finish the look.App StoreThere’s an app for that.With over one and a half million apps in the App Store, you’ll be able to make your phone your own. Whether you browse by category or search for something specific, quickly discover and download new apps with a tap.Your wish is its command.Siri is your personal assistant, letting you use your voice to send messages, search the web, get guidance on public transport and more. You can even ask Siri to search your photo library to find just the photo or video you’re looking for.CameraThe only camera you’ll ever need.With a 12‑megapixel iSight camera, you can be sure to capture sharp, detailed stills like the ones shot on iPhone 6s. That includes shooting and even editing brilliant 4K video, which is up to four times the resolution of 1080p HD video.Live Photos.Capture more than a moment.Live Photos bring your still photos to life with sound and movement. Simply touch and hold anywhere on your 12‑megapixel still and experience the moments just before and after it was taken, so your photos turn into living memories.FaceTime HD camera with Retina Flash.Your selfie just got more beautiful.The Retina display isn’t just a place to see your content it’s a flash for your FaceTime HD camera. Powered by a custom display chip that allows the display to flash three times brighter than usual, Retina Flash helps illuminate your selfies in low light and at night. And a True Tone flash matches the ambient light for more true-to-life colours and natural-looking skin tones.iCloud Photo Library.All your photos and videos, always with you.iCloud Photo Library stores every photo and video you take, and keeps them up to date on all your devices. Any edits you make are automatically updated everywhere, so you can view a photo from last week or last year no matter where you are.Touch IDAdvanced security. At your fingertip.Touch ID makes unlocking your iPhone SE simple and secure. After all, your fingerprint is the perfect password no two are alike and you always have it with you.WirelessUltra‑fast wireless and Wi‑Fi.Browse the web, download apps, games and stream video over 802.11ac Wi-Fi and ultra‑fast wireless. iPhone SE also supports Wi-Fi calling for high-quality wideband calls. And with Bluetooth technology, you can stay connected to your Apple Watch, external speakers and other devices.TechnologyThe most powerful 4‑inch phone ever.At the core of iPhone SE is the A9, the same advanced chip that’s in iPhone 6s. With 64‑bit desktop-class architecture, the A9 chip brings you spectacular speed and responsiveness. And with console-class graphics performance, your favourite games and apps are incredibly rich and immersive. Making it a mighty chip for maximum performance.Super-efficient M9 motion coprocessor.Embedded directly into the A9 chip, the M9 motion coprocessor connects to the accelerometer, compass and gyroscope for a range of ﬁtness tracking capabilities, such as measuring your steps and distance. It also makes it easy to activate Siri by simply saying “Hey Siri” without having to pick up your iPhone.iOS 9Hardware and software made for each other.With an easy-to-use interface, amazing features and security at its core, iOS 9 is the most advanced mobile operating system and the foundation of iPhone SE. It’s designed to look beautiful and work beautifully on your iPhone, so even the simplest tasks are more fun.Apps that help you do more every day.Your iPhone comes with a collection of essential apps straight out of the box. Messages lets you send texts with photos, videos links and more. Music makes it easy to access the entire Apple Music library along with your personal collection. With FaceTime you can make video calls from your iPhone to someone else’s iPhone, iPad or Mac. And Maps keeps you headed in the right direction.","12‑megapixel camera captures incredible photos and 4K videos, retina flash, ƒ/2.4 aperture, auto HDR for photos, backside illumination sensor, exposure control, improved local tone mapping, face detection, timer mode, burst mode and 1.2MP front facing camera","4-inch (10.16 centimeters) LED-backlit multi-touch capacitive touchscreen with 1136 x 640 pixels resolution and 326 ppi pixel density","iOS v9 operating system with A9 chip 64-bit architecture, embedded M9 motion coprocessor, 2GB RAM, 16GB internal memory and single nano SIM","Built-in rechargeable lithium-ion battery providing talk-time of 14 hours on 3G and standby time of 12 hours on 3G networks, 13 hours on WiFi","1 year manufacturer warranty for device and in-box accessories including batteries from the date of purchase","http://ecx.images-amazon.com/images/I/515Qv-2uGZL._SX38_SY50_CR,0,0,38,50_.jpg","http://ecx.images-amazon.com/images/I/31DFse9%2BIQL._SX38_SY50_CR,0,0,38,50_.jpg","http://ecx.images-amazon.com/images/I/21TsxBuIeDL._SX38_SY50_CR,0,0,38,50_.jpg","NA","NA","Electronics","Mobiles & Accessories","Smartphones & Basic Mobiles","Smartphones","NA",
"http://www.amazon.in/Apple-iPhone-Rose-Gold-32GB/dp/B01LZWIOS4/ref=sr_1_19/260-4410877-3570616?s=electronics&ie=UTF8&qid=1498375553&sr=1-19&keywords=iphone+6","Apple iPhone 7 (Rose Gold, 32GB)","60,000.00","44,290.00","FREE Delivery","TigeRetaiL_SLP","NA","NA","12MP primary camera with optical image stabilisation, Quad-LED True Tone flash and Live Photos, 4K video recording at 30 fps and slow-motion video recording in 1080p at 120 fps, 7MP front facing FaceTime HD camera with Retina Flash","4.7-inch (diagonal) Retina HD 3D Touch capacitive touchscreen display and home button with 1334x750 resolution and wide colour, Splash, water and dust resistant","iOS 10 and iCloud operating system with A10 Fusion chip with integrated M10 motion coprocessor, 32GB internal memory and single Nano-SIM","Non-removable Li-Ion 1960 mAh battery (7.45 Wh) providing talktime up to 14 hours on 3G network","1 year manufacturer warranty for device and in-box accessories including batteries from the date of purchase","http://ecx.images-amazon.com/images/I/51AUm5TYJsL._SX38_SY50_CR,0,0,38,50_.jpg","http://ecx.images-amazon.com/images/I/314PcnUo44L._SX38_SY50_CR,0,0,38,50_.jpg","http://ecx.images-amazon.com/images/I/21Tigls5dJL._SX38_SY50_CR,0,0,38,50_.jpg","http://ecx.images-amazon.com/images/I/41KgflqGbDL._SX38_SY50_CR,0,0,38,50_.jpg","NA","Electronics","Mobiles & Accessories","Smartphones & Basic Mobiles","Smartphones","NA",
"http://www.amazon.in/Apple-iPhone-6-Silver-16GB/dp/B014KHBK7K/ref=sr_1_20/260-4410877-3570616?s=electronics&ie=UTF8&qid=1498375553&sr=1-20&keywords=iphone+6","Apple iPhone 6 (Silver, 16GB)","NA","NA","NA","NA","NA","It protects your Phone back and frame from Fingerprints, Scratches, Dusts, Collisions And Abrasion. Flexible material, makes it easy to install and remove. Rich Sparkle Soft Silicone Glitter Back Cover gives premium luxury look to phone. New 2017 Model","Dual-core 1.4 GHz Cyclone (ARM v8-based), PowerVR GX6650 (hexa-core graphics), Apple 8 Chipset, GSM 850 / 900 / 1800 / 1900, HSDPA 850 / 900 / 1700 / 1900 / 2100, LTE 700/800/850/900/1700/1800/1900/2100/2600, Nano-SIM (GSM)","16GB, 1 GB RAM, LED-backlit IPS LCD, capacitive touchscreen, 16M colors, 750 x 1334 pixels, 4.7 inches (~326 ppi pixel density), Multitouch, Shatter proof glass, oleophobic coating","DC-HSDPA, 42 Mbps; HSUPA, 5.76 Mbps; EV-DO Rev. A, up to 3.1 Mbps; LTE, Cat4, 150 Mbps DL, 50 Mbps UL, Wi-Fi 802.11 a/b/g/n/ac, dual-band, Wi-Fi hotspot, Bluetooth v4.0, A2DP, LE","8 MP, 3264 x 2448 pixels, phase detection autofocus, dual-LED (dual tone) flash, 1/3'' sensor size, 1.5µm pixel size, geo-tagging, simultaneous HD video and image recording, touch focus, face/smile detection, HDR (photo/panorama), Front 1.2 MP, 720p@30fps, face detection, FaceTime over Wi-Fi or Cellular, iOS 8, Non-removable Li-Po 1810 mAh battery (6.9 Wh)","1 Year Seller Warranty Only for Software Related Issues, Not for hardware. For Software Related Issues buyer has to sebd item at Seller's location.","http://ecx.images-amazon.com/images/I/51P89kgrAoL._SX38_SY50_CR,0,0,38,50_.jpg","NA","NA","NA","NA","Electronics","Mobiles & Accessories","Smartphones & Basic Mobiles","Smartphones","NA",
