Url,Title,MRP,Price,Shipping,Seller,Promo,Description,Highlight1,Highlight2,Highlight3,Highlight4,Highlight5,Image1,Image2,Image3,Image4,Image5,Category1,Category2,Category3,Category4,Category5,
"http://www.amazon.in/Apple-iPhone-128GB-PRODUCT-RED/dp/B01N1TYYXM/ref=sr_1_47?s=electronics&ie=UTF8&qid=1498375560&sr=1-47&keywords=iphone+6","Apple iPhone 7 128GB (PRODUCT) RED","70,000.00","61,900.00","FREE Delivery","e9accessories","NA","NA","12MP primary camera with optical image stabilisation, quad-LED true tone flash and live photos, 4K video recording at 30 fps and slow-motion video recording in 1080p at 120 fps and 7MP front facing facetime HD camera with retina flash","11.93 centimeters (4.7-inch) LCD capacitive touchscreen with 750 x 1334 pixels resolution, 326 ppi pixel density, 16M color support with wide colour, splash, water and dust resistant","IOS v10.3 operating system with 1.3GHz Apple A10 Fusion chip with integrated M10 motion quad core processor, 2GB RAM, 128 internal memory and single nano SIM","Non-removable 1960mAH lithium-ion battery providing talk-time of 14 hours","1 year manufacturer warranty for device and 6 months manufacturer warranty for in-box accessories including batteries from the date of purchase","http://ecx.images-amazon.com/images/I/51BR204yKjL._SX38_SY50_CR,0,0,38,50_.jpg","http://ecx.images-amazon.com/images/I/312f-5MneGL._SX38_SY50_CR,0,0,38,50_.jpg","http://ecx.images-amazon.com/images/I/21jgguKQoDL._SX38_SY50_CR,0,0,38,50_.jpg","http://ecx.images-amazon.com/images/I/31RRDIyk2pL._SX38_SY50_CR,0,0,38,50_.jpg","http://ecx.images-amazon.com/images/I/41uQd1YlgfL._SX38_SY50_CR,0,0,38,50_.jpg","Electronics","Mobiles & Accessories","Smartphones & Basic Mobiles","Smartphones","NA",
"http://www.amazon.in/Apple-iPhone-7-Gold-128GB/dp/B01LWNBFFA/ref=sr_1_48?s=electronics&ie=UTF8&qid=1498375560&sr=1-48&keywords=iphone+6","Apple iPhone 7 (Gold, 128GB)","70,000.00","52,410.00","FREE Delivery","Bajaj Digital","NA","NA","12MP primary camera with optical image stabilisation, Quad-LED True Tone flash and Live Photos, 4K video recording at 30 fps and slow-motion video recording in 1080p at 120 fps, 7MP front facing FaceTime HD camera with Retina Flash","4.7-inch (diagonal) Retina HD 3D Touch capacitive touchscreen display and home button with 1334x750 resolution and wide colour, Splash, water and dust resistant","iOS 10 and iCloud operating system with A10 Fusion chip with integrated M10 motion coprocessor, 128GB internal memory and single Nano-SIM","Non-removable Li-Ion 1960 mAh battery (7.45 Wh) providing talktime up to 14 hours on 3G network","1 year manufacturer warranty for device and in-box accessories including batteries from the date of purchase","http://ecx.images-amazon.com/images/I/51StBYU9XfL._SX38_SY50_CR,0,0,38,50_.jpg","http://ecx.images-amazon.com/images/I/31RcYfD2FvL._SX38_SY50_CR,0,0,38,50_.jpg","http://ecx.images-amazon.com/images/I/21Kh96ax1nL._SX38_SY50_CR,0,0,38,50_.jpg","http://ecx.images-amazon.com/images/I/41uhhGosFVL._SX38_SY50_CR,0,0,38,50_.jpg","NA","Electronics","Mobiles & Accessories","Smartphones & Basic Mobiles","Smartphones","NA",
"http://www.amazon.in/gp/slredirect/picassoRedirect.html/ref=pa_sp_btf_electronics_sr_pg2_1?ie=UTF8&adId=A06319673JIFKQ3S8T5X4&url=http%3A%2F%2Fwww.amazon.in%2FLightning-Tech-Sense-Lab-Compatibility%2Fdp%2FB01A6GGDDK%2Fref%3Dsr_1_49%3Fs%3Delectronics%26ie%3DUTF8%26qid%3D1498375560%26sr%3D1-49-spons%26keywords%3Diphone%2B6%26psc%3D1&qualifier=1498375559&id=4618017296103339&widgetName=sp_btf","Nylon Braided, Elegant & Tangle Free Lightning Cable [Apple MFI Certified] by Tech Sense Lab, 1m / 40 Inches with 100% Sync & Charge Compatibility With Apple Devices Incl. iPhones, iPads, iPods (Silver Grey)","1,499.00","NA","FREE Delivery","Tech Sense Lab - India","NA","Colour:Silver GreyAre you Sick and Tired of Duplicate MFI Cables that stop working after a week ? Stop Buying duplicate cables every week and buy the one cable to end all cables. Sturdy and tangle-free design-covered with braided-nylon fiber jacket and anodized aluminum shell which is durable and more than 2 times sturdier than the normal lightning cable but also flexible and tangle-free. Apple MFi Certified with 8 Pin Chip ?  Each cable contains a unique, verified serial number and an authorization chip issued by Apple which communicates with any lightning connector device to ensure 100% compatibility.High Speed Charge & Sync with 2.4A max ? Support fast charge with max 2.4 amp charging capabilities from the 2.4A output USB port on wall chargers or car chargers.Stylish High Quality Nylon Fiber ? High quality nylon fiber jacket provides higher durability and increased flexibility. The braided covering makes it stand out from bunch of cables and also looks much more attractive, even when not in use.Tangle Free ? Tangle free cord design eliminates bunching, tangles, and knots.Extra Heavy Duty  ? Our cable is reinforced with anodized aluminum shell designed for extended durability and reliability. Lab Tested to 4000 Bends this cable performs over time and won't let you down.  Warranty ? At Tech Sense Lab, we believe in our products. That's why we back them all with an 6 + 6 Month warranty and 16 hours response guarantee for any queries sent our way.Here's why you should buy our cables.  Tech Sense Lab is one place Where Quality matters ! We care about customers and customer service TSL Guarantee. 6 + 6 Months upon registration. Original MFI Certification 16 hours response guarantee for any queries sent our way.","ORIGINAL APPLE MFI CERTIFICATION ✔ Each cable contains a unique, verified serial number and an authorization chip issued by Apple to ensure 100% compatibility with any Lightning device. Verify our certification for yourself by searching for Tech Sense Lab on MFI (Made for iPhone /iPad/iPod accessories website)","INCREDIBLY DURABLE TESTED TO 4000 TURNS ✔ We tested this cable in our Lab by bending over 4000 times and saw no damage or change in performance. Premium nylon fabric feels great and doesn't tangle.","COMPACT DESIGN PERFECT FIT ✔ The super slim Aluminium Lightning connector head slots into most case openings. Don't be denied your case of choice by a bulky cable.","100% SYNC AND CHARGE COMPATIBILITY TO ANY LIGHTNING DEVICE✔ iPhone 7/7 Plus/6/6 Plus/6S/5/5C/5S/SE, iPad mini Series , Apple Air Series, iPad 3/4, iPod touch 5th gen, for iPod nano 7th gen with Tech Sense Lab 6 + 6 Month Guarantee","DOUBLE TECH SENSE LAB GUARANTEE 6 + 6 MONTHS ✔ Unlike other drop shippers and imported products we are FBA which means quicker delivery, and most importantly local easy guarantee which can be doubled upon registration.","http://ecx.images-amazon.com/images/I/511ksCuzBpL._SS40_.jpg","http://ecx.images-amazon.com/images/I/51I1wqBJzTL._SS40_.jpg","http://ecx.images-amazon.com/images/I/41WGJUpVw5L._SS40_.jpg","http://ecx.images-amazon.com/images/I/519P0PU1ovL._SS40_.jpg","http://ecx.images-amazon.com/images/I/51XK6ngungL._SS40_.jpg","Electronics","Mobiles & Accessories","Mobile Accessories","Data Cables","NA",
"http://www.amazon.in/gp/slredirect/picassoRedirect.html/ref=pa_sp_btf_electronics_sr_pg2_2?ie=UTF8&adId=A0004218YWFUMW3GMTR1&url=http%3A%2F%2Fwww.amazon.in%2FBranko-iPhone-Lightning-Indestructible-Charge%2Fdp%2FB06X9PVYT8%2Fref%3Dsr_1_50%3Fs%3Delectronics%26ie%3DUTF8%26qid%3D1498375560%26sr%3D1-50-spons%26keywords%3Diphone%2B6%26psc%3D1&qualifier=1498375559&id=4618017296103339&widgetName=sp_btf","Branko iPhone Lightning Cable || Indestructible 5ft long Nylon Mesh Tough Charge & Sync Lightning Cable For Apple iPhone 7/ 7Plus , 6/ 6 Plus, 5S/5C/5, iPad Air 1/2, iPad2/3/4, iPad Mini 1/2/3, iPad Retina and iPod Touch","999.00","NA","FREE Delivery","TheGadgetStore","NA","Branko Indestructible 6ft long Nylon Mesh Tough Charge & Sync Lightning CableTired of your Apple lightning cable breaking apart at the connectors? Wish you had a longer version, so you could use your device comfortably while it's charging? Replace your short factory cord with the BRANKO Lightning Cable! Use it with your Apple iPhone, iPad or iPod and enjoy the freedom of being able to use your device on the bed or couch while it's plugged in. Thanks to built-in strain relief reinforcements, you can move around easily without worrying about the cable disconnecting from the lightning or USB connector. Comes with 1 Year Warranty!Tangle-Free Braided Nylon ,Unbreakable Design ,Long for Comfort and Convenience While factory and cheap cables break after 6 months, ours is made of strong, flexible nylon that endures heavy usage without constantly getting knotted up.Integrated strain relief reinforcements ensure it won't break at the connectors. Sturdy aluminum connector ensures high conductivity and superior signal transfer.Compatible DevicesiPhone 7 PlusiPhone 7iPhone 6iPhone 6SiPhone 6S PlusiPhone 6 PlusiPhone 5SiPhone 5CiPhone 5iPad ProiPad Air / Air 2 / iPad mini / mini 2 / mini 4 / iPad 4th gen / iPod Touch 5th gen / iPod nano 7th gen and Beats Pill+Package Content: 1 X Branko Nylon Braided Lightning Cable 1.5MWarranty Description:1. 12-Month Worry-Free Warranty, Carefree Service2. Free Lifetime Technical Support3.24-Hours Instant Response E-mail Address: starcaseenterprises@gmail.com","TOUGH BRAIDED CABLE : Indestructible 6ft long Nylon Mesh Tough cable for fast Charge And Quick Data Sync Lightning Cable For Apple iPhone 7/ 7Plus , 6/ 6 Plus, 5S/5C/5, iPad Air 1/2, iPad2/3/4, iPad Mini 1/2/3, iPad Retina and iPod Touch .","TOUGH NYLON MESH BRAIDED . Military Grade Nylon Mesh braided heavy-duty cable skin, is stress and stretch resistant, protects against day-to-day wear and tear","99.99% oxygen free copper Conductor Make Charging And Signal Transmission Faster","EXTRA DURABLE . The Aluminium Foil + Metal Mesh coating will not only protect your wire from normal breakage, but will also enhance the durability and life time of the cable.","1 YEAR WARRANTY : Branko's cable is covered by 1-Year Replacement Warranty. , ROHS Certified","http://ecx.images-amazon.com/images/I/51es56Tbd8L._SS40_.jpg","http://ecx.images-amazon.com/images/I/419TPFk7aiL._SS40_.jpg","http://ecx.images-amazon.com/images/I/411IuLLxD2L._SS40_.jpg","http://ecx.images-amazon.com/images/I/51EZ57shM2L._SS40_.jpg","http://ecx.images-amazon.com/images/I/51TPEp7h9KL._SS40_.jpg","Electronics","Mobiles & Accessories","Mobile Accessories","Data Cables","NA",
"http://www.amazon.in/gp/slredirect/picassoRedirect.html/ref=pa_sp_btf_electronics_sr_pg2_3?ie=UTF8&adId=A0793823XGU4ASLPK9Y2&url=http%3A%2F%2Fwww.amazon.in%2FMMOBIEL-PLUS-82v-2915-mAh%2Fdp%2FB01ENEL3R2%2Fref%3Dsr_1_51%3Fs%3Delectronics%26ie%3DUTF8%26qid%3D1498375560%26sr%3D1-51-spons%26keywords%3Diphone%2B6%26psc%3D1&qualifier=1498375559&id=4618017296103339&widgetName=sp_btf","MMOBIEL Battery for Iphone 6 PLUS Li-Ion 3,82v 2915 mAh 6.9 Whr + Anti-Static Adhesive Glue Sticker 2 x Pry + 2 x screwdrivers + Manual by MMOBIEL","NA","789.00","FREE Delivery","Menko Tel","NA","•Battery for iPhone 6 Plus A1522 A1524 A1593 Li-Ion 3,82v 2915 mAh 6.9 Wh incl. 2 x screwdrivers MMOBIEL •Easy to replace and fits precisely! New / 0 charging cycles •Compatible with all APN No. •High Quality Product by MMOBIEL •Item in stock Shipped from India!","Battery for Iphone 6 PLUS Li-Ion 3,82v 2915 mAh 6.9 Wh incl Anti-Static Adhesive Glue Sticker 2x Pry 2x screwdrivers + manual by MMOBIEL","HIGH QUALITY PROFESSIONAL All-IN-ONE KIT: This MMOBIEL iPhone battery replacement kit includes all Tools that You need to Change your Iphone battery in approx 15 minutes.","EASY INSTALLATION: Comprehensive Repair kit as well easy to follow step-by-step instruction manual with colored images compliments the installation process. You don't need a technician to do it.","COMPATIBILITY: This Battery is Compatible with all GSM & CDMA iPhone 6 Plus all APN 616-0765 / 616-0772 / 616-0802 Versiona with Model Types A1522 A1524 A1593","HIGH QUALITY: Each battery is tested before shipment, New Zero Cycle, Internal chips prevent the battery from overheating, short-circuiting. Item in Stock Shipped from India","http://ecx.images-amazon.com/images/I/51SYsemdu7L._SX38_SY50_CR,0,0,38,50_.jpg","http://ecx.images-amazon.com/images/I/51hWJJPiwcL._SX38_SY50_CR,0,0,38,50_.jpg","http://ecx.images-amazon.com/images/I/41N%2B5Z7mfML._SX38_SY50_CR,0,0,38,50_.jpg","http://ecx.images-amazon.com/images/I/514IBjECo6L._SX38_SY50_CR,0,0,38,50_.jpg","http://ecx.images-amazon.com/images/I/41IqZOa9TAL._SX38_SY50_CR,0,0,38,50_.jpg","Electronics","Mobiles & Accessories","Mobile Accessories","Internal Batteries","NA",
"http://www.amazon.in/HTC-Desire-10-Pro-Stone/dp/B01MS4QKJZ/ref=sr_1_49?s=electronics&ie=UTF8&qid=1498375567&sr=1-49&keywords=iphone+6","HTC Desire 10 Pro (Stone Black)","NA","21,350.00","FREE Delivery","TECHOHOLIC","NA","Introducing HTC Desire 10 pro. With high-resolution cameras back and front, elegant, metallic design, and top-tier features like integrated fingerprint sensor and 64GB internal storage space. All of which add up to make it our best Desire phone yet. Smile for the selfie camera that has the same sensor pixel count as the main camera in many other phones. If you're serious about great-looking selfies then you'll appreciate the HTC Desire 10 pro's 13MP selfie camera. It promises you higher resolution selfies that capture more scenery and good time with friends. This selfie camera also features a built-in screen flash, which helps you take brighter selfies in low light. Protect your valuable data. HTC Desire 10 pro's fingerprint security keeps your data safe, but quickly unlocks at just the touch of your finger. The sensor recognizes your fingerprint from almost every angle and position. And, with the App Lock function in Boost+, your fingerprint can also be used to help prevent your apps from being opened by others. Make your phone as unique as you are. HTC Freestyle Layout frees you from an onscreen grid and lets you get creative. Drag icons, stickers and widgets anywhere. Layer them, overlap them, group them and more. You can even link stickers to apps, and get rid of onscreen icons entirely. The home screen is yours, use it your way. HTC Desire 10 pro gives you more space for the things that are important with a massive 4GB of RAM and 64GB storage space. So you can load up on photos, videos, movies, games and more. And if that's not enough room, HTC Desire 10 pro has SD card support for up to 2TB expandable memory.","13.97 centimeters (5.5-inch) IPS Gorilla glass color personalization (w/CCT tuning) capacitive touchscreen with 1080 x 1920 pixels resolution and 400 ppi pixel density","Android v6.0 Marshmallow operating system with 1.8 GHz 64-bit MediaTek Helio P10 octa core processor, 4GB RAM, 64GB internal memory expandable up to 2TB and dual SIM (nano+nano) dual-standby (4G+3G)","3000mAH lithium-ion battery providing talk-time of 19 hours and standby time of 480 hours on 3G and 432 hours on 4G","20MP primary camera with laser auto focus, BSI sensor, ƒ/2.2 aperture and 27.8mm focal length, auto HDR mode, panorama mode, continuous shooting, pro mode with manual control raw format, anti-shake, white balance, face beauty zoe camera and 13MP front facing camera with BSI sensor, ƒ/2.2 aperture and 27.8mm focal length, voice selfie, live make-up, selfie panorama, self timer up to 10 seconds, touch to capture, volume button as shutter button, up to full HD 1080p video recording, auto HDR mode, mirror preview, retina flash","1 year manufacturer warranty for device and 6 months manufacturer warranty for in-box accessories including batteries from the date of purchase","http://ecx.images-amazon.com/images/I/41SmpViGMzL._SX38_SY50_CR,0,0,38,50_.jpg","NA","NA","NA","NA","Electronics","Mobiles & Accessories","Smartphones & Basic Mobiles","Smartphones","NA",
"http://www.amazon.in/Samsung-J7-Prime-32GB-VoLTE/dp/B06Y3HFZBQ/ref=sr_1_50?s=electronics&ie=UTF8&qid=1498375567&sr=1-50&keywords=iphone+6","Samsung J7 Prime 32GB ( Gold ) 4G VoLTE","NA","15,900.00","FREE Delivery","Ganesha_SLP","NA","Samsung Galaxy J7 Prime has a metal body and a 5.5-inch 2.5D glass display that comes with 1920x1080 pixels resolution and Gorilla Glass 4. It is powered by a 1.6 GHz octa-core processor, which is paired with 3GB RAM and 32GB internal storage. An expandable storage slot is there for a micro SD card of up-to 256 GB capacity. The smartphone runs on Android 6.0 Marshmallow operating system and also offers a fingerprint scanner, which is integrated into the home button. The Galaxy J7 Prime has a 3300 mAh battery and comes with S Bike mode. To activate S Bike mode, all you have to do is attach an NFC tag, which comes bundled with the phone, with your bike (like on the petrol tank). Just before getting on your bike, the user just needs to tap the phone with the NFC tag that will turn on the S Bike mode. Once activated, callers will hear a message that the person is riding and they can leave messages. Moreover, It has also comes equipped with S Power planning and S Secure features. The S Power planning mode extends battery life and the S Secure feature allow users to hide and lock applications, secure WiFi and create a separate Secure folder for images and applications.","5.5-Inch PLS TFT capacitive touchscreen, 16M colors Display with 1.6GHz Octa Core ,Samsung Exynos 7 Octa 7870 Processor, Resolution 1080 x 1920 pixels , Pixel Density 401 ppi","Rear Camera - 13 MP , Front Camera 8 MP, F1.9 Aperture, LED Flash, (Autofocus, Voice Capture, Face Beauty, HDR, Scene Modes, Smile detection, Face Detection, Self timer, Touch focus, Gesture Shot, Makeup Effects, Pro Mode)","Ram Size - 3 GB , Internal Memory - 32GB , Expandable upto 256 Micro SD Card , Video Recording","Operating System Android 6.0 Marshmallow ,Dual Sim ,2G 3G 4G/VoLTE ,GPRS, EDGE,Touchscreen (Capacitive Multipoint-Touch)","Finger Print Sensor is available Non-removable Li-Ion 3300 mAh battery Talktime Upto 20 Hours, Standby Upto 350 Hours ,Bluetooth 4.1 ,(Wi-Fi 802.11 b/g/n, Wi-Fi Direct, hotspot) , Fingerprint, Proximity, Accelerometer , OTG Support , Jio Compatible","http://ecx.images-amazon.com/images/I/31n1xbQSVqL._SX38_SY50_CR,0,0,38,50_.jpg","http://ecx.images-amazon.com/images/I/31Lz57cECYL._SX38_SY50_CR,0,0,38,50_.jpg","http://ecx.images-amazon.com/images/I/31ZoIKAdD9L._SX38_SY50_CR,0,0,38,50_.jpg","http://ecx.images-amazon.com/images/I/41W9g%2B6RDCL._SX38_SY50_CR,0,0,38,50_.jpg","http://ecx.images-amazon.com/images/I/312M1tXE1SL._SX38_SY50_CR,0,0,38,50_.jpg","Electronics","Mobiles & Accessories","Smartphones & Basic Mobiles","Smartphones","NA",
"http://www.amazon.in/Apple-iPhone-6s-Rose-128GB/dp/B016QBU8I0/ref=sr_1_51?s=electronics&ie=UTF8&qid=1498375567&sr=1-51&keywords=iphone+6","Apple iPhone 6s (Rose Gold, 128GB)","NA","48,900.00","FREE Delivery","TigeRetaiL_SLP","NA","Colour:Rose GoldProduct descriptionAppleFrom the ManufacturerA breakthrough design. Pushed even further.iPhone 6s - Take everything that made the previous generation great, and advance it to a new level. They’re made with 7000 Series aluminium, the strongest alloy we’ve ever used in an iPhone. They both feature Retina HD displays made from the strongest cover glass used on any smartphone in the world. And now they’re available in an elegant new rose gold ﬁnish.Sleek and seamless, in four gorgeous ﬁnishes.The smooth, continuous unibody design created for iPhone 6 comes to iPhone 6s. Its familiar form feels just right in your hand. And now there are four stunning ﬁnishes to choose from: gold, silver, space grey, and the new rose gold.The world’s strongest smartphone glass. Now even stronger.The new glass on iPhone 6s is made using a special dual ion‑exchange process, which makes it stronger at a molecular level and the most durable in the smartphone industry.7000 Series aluminium. Stronger from the outside in.The iPhone 6s enclosure is made from the same grade used in the aerospace industry. This aluminium is created from a unique composition of elements that make it the strongest alloy we’ve ever used in an iPhone.They come in Perfect sizes. And perfect.iPhone 6s have stunning Retina HD displays. No matter which size you choose, your apps, photos and just about everything else will look vibrant and sharp. High-contrast, dual-domain pixels, and accurate colours ensure that whatever’s on your screen, you’ll love what you see.3D TouchiPhone 6s was designed specifically to work with 3D Touch, the next generation of Multi-Touch. 3D Touch is a revolutionary pressure‑sensing technology that lets you get to the content you want simply by pressing the display. Capacitive sensors measure the pressure you apply on the glass. You instantly see a response on the screen and feel feedback from the all‑new Taptic Engine. 3D Touch is a perfect example of the magic that happens when hardware and software are designed together. 3D Touch can only perform because it was designed alongside iPhone 6s.Touch IDPlace your ﬁnger on the Home button, and just like that your iPhone unlocks. Touch ID is just as secure as before and now works even faster. You can use it within participating apps to sign in and authenticate purchases.A9 chipThe A9 chip is made speciﬁcally for iPhone. By designing our own chip, we can tailor its performance to how people really use their iPhone. So the things you do every day — browsing the web, using apps, taking photos — work even better. This level of integration between the A9 chip and iOS 9 means that your iPhone performs better and works more eﬃciently than if we used an off-the-shelf chip that we didn’t design.Your iPhone is beautiful. Give it a complement.We take great care in designing every aspect of iPhone 6s, including the cases and accessories. Choose a natural leather case in one of ﬁve colours, or go with vibrant silicone in one of 11 colours. And to keep you charged at home, there are now colour‑matched Apple‑designed metal docks.12MP pictures. 4K videos. Live Photos. Lasting memories.People love to take pictures with iPhone. In fact, it’s the most popular camera in the world. But what people love even more are the memories that are preserved within those images. Those memories are now incredibly vivid with Live Photos, an entirely new way to bring your still photos to life.Lights. 4K camera. Action.The game-winning shot. The impromptu dance party. The first ride without stabilisers. Some things are meant for video. Now you can record those moments in resolution that’s four times higher than HD video. You can zoom in on those 8 million pixels while you’re shooting or playing your 4K videos.Deeply powerful.The innovation begins from within. At every possible opportunity, iPhone 6s has been engineered to work better. More intuitively. And more eﬃciently. iPhone 6s also introduces groundbreaking new technologies, including 3D Touch and Live Photos.64-bit desktop-class architecture.The A9 chip is our third-generation chip with 64-bit architecture. It sits at the cutting edge of mobile chips, improving overall CPU performance by up to 70 per cent compared to the previous generation. And boosting graphics performance by up to a staggering 90 per cent compared to the previous generation.Ultra-fast wireless.Faster Wi‑Fi.iPhone 6s lets you browse the web, download apps and games, and stay connected with the people who matter to you. And with iPhone 6s, you can connect to more networks in more places for even better worldwide roaming. iPhone 6s is also up to twice as fast when you’re connected to Wi‑Fi. And with Bluetooth technology, you’ll stay connected to your Apple Watch, external speakers and hundreds of other devices.*Touch ID. Advanced security.Right at your ﬁngertip.Touch ID lets you unlock your phone simply by using your ﬁngerprint. It uses highly sophisticated algorithms to recognise and securely match your ﬁngerprint. And the improved Touch ID sensor detects your ﬁngerprint even faster than the previous generation.Software and hardware. A deeper connection.If iPhone 6s seems like it’s tailor‑made for iOS, that’s because it is. Each hardware component — from the A9 chip to the Home button — is designed to get the most out of iOS. And likewise, iOS is designed to maximise the performance and functionality of the hardware it runs on. Together, they deliver a powerful and enjoyable experience because they were designed that way — together.The new standard in phone photography comes as standard.iPhone 6s introduces a next-generation, Apple-designed image signal processor to provide better temporal and spatial noise reduction as well as third-generation local tone mapping. Every pixel in the sensor has been re-engineered to prevent crosstalk between the subpixels, meaning we could fit a lot more pixels in the sensor for a sharper photo that has less noise and truer colour. iPhone 6s features optical image stabilisation for videos in addition to photos, so you can get great shots in low light.","12MP primary camera with auto focus, 4K video recording, flash and 5MP front facing camera","4.7-inch (11.4 centimeters) Retina HD 3D-touch capacitive touchscreen with 1334 x 750 pixels resolution and 326 ppi pixel density","iOS v9 operating system with A9 chip 64-bit architecture processor, 2GB RAM, 128GB internal memory and single nano SIM","Lithium-ion battery providing talk-time of 14 hours on 3G networks and standby time of 240 hours","1 year manufacturer warranty for device and 6 months manufacturer warranty for in-box accessories including batteries from the date of purchase","http://ecx.images-amazon.com/images/I/4174qk-98lL._SX38_SY50_CR,0,0,38,50_.jpg","http://ecx.images-amazon.com/images/I/41HxCUMaROL._SX38_SY50_CR,0,0,38,50_.jpg","http://ecx.images-amazon.com/images/I/41vME8It%2BSL._SX38_SY50_CR,0,0,38,50_.jpg","NA","NA","Electronics","Mobiles & Accessories","Smartphones & Basic Mobiles","Smartphones","NA",
