Url,Title,MRP,Price,Shipping,Seller,Promo,Description,Highlight1,Highlight2,Highlight3,Highlight4,Highlight5,Image1,Image2,Image3,Image4,Image5,Category1,Category2,Category3,Category4,Category5,
"http://www.amazon.in/Apple-iPhone-6s-Plus-Space/dp/B016QBUBCS/ref=sr_1_31?s=electronics&ie=UTF8&qid=1498375560&sr=1-31&keywords=iphone+6","Apple iPhone 6s Plus (Space Grey, 16GB)","NA","42,970.00","FREE Delivery","TECHOHOLIC","NA","Colour:Space GreyProduct DescriptionApple iPhone 6S PlusHigh Performance with Precision DesignApple iPhone 6S Plus is the upgrade that you should own to enjoy futuristic technology. Apple’s tailor made A9 chip is meant especially for the iPhone users and to ease their day to day operations. With a 64-bit architecture, the A9 chip is a third generation chip that boosts the CPU performance along with its graphic performance. The iOS 9 operating system enhances the performance of A9 chip and the iPhone’s hardware. The high performing hardware and software is integrated inside a 7,000 series aluminium alloy body that is equivalent to aerospace industry grade material to make it sturdy and tough. The smooth bezel is compact, 15.8 x 0.7 x 7.8 cm, and yet light weight, 191 g, that give you an easy and comfortable grip.Wider and Tougher Display with Advanced CameraWith a sturdy bezel, the display screen of the iPhone 6S Plus is equally strong. It is forged with special dual ion-exchange process to make it tougher and stronger on a molecular level to withstand damage caused by accidental slips and drops. The Retina Full HD display has a resolution of 1080 x 1920 pixels with 401 ppi pixel density for a detailed and vibrant picture quality. The screen is layered with finger print resistant and oil repellent coating. The display is 3D touch enabled with the Taptic Engine that measure the pressure applied on any particular application or content and get instant response or feedback on the screen. The iPhone 6S Plus has a 12 MP rear camera with flash which can capture HD pictures and 4K videos so you can relive your memorable moments. It is loaded with several advanced features like Live Photos, Autofocus, True Tone Flash, Burst Mode and more. The front camera is 5 MP for FaceTime with features like Face Detection, Exposure Control, Timer Mode and more.Powerful Battery Backup and Superior Security SystemIt is strapped with 2750 mAh Lithium-Polymer battery that lasts up to 24 hours of talk time with 3G connectivity and 384 hours of standby time. Stay connected and do more with long hours of battery life. With advanced fingerprint detecting Touch ID, you can unlock your phone in a jiffy. Upgrade to the iPhone 6S Plus to enjoy the technology from the future.From the ManufacturerA breakthrough design. Pushed even further.iPhone 6s Plus - Take everything that made the previous generation great, and advance it to a new level. They’re made with 7000 Series aluminium, the strongest alloy we’ve ever used in an iPhone. They both feature Retina HD displays made from the strongest cover glass used on any smartphone in the world. And now they’re available in an elegant new rose gold ﬁnish.Sleek and seamless, in four gorgeous ﬁnishes.The smooth, continuous unibody design created for iPhone 6 comes to iPhone 6s Plus. Its familiar form feels just right in your hand. And now there are four stunning ﬁnishes to choose from: gold, silver, space grey, and the new rose gold.The world’s strongest smartphone glass. Now even stronger.The new glass on iPhone 6s Plus is made using a special dual ion‑exchange process, which makes it stronger at a molecular level and the most durable in the smartphone industry.7000 Series aluminium. Stronger from the outside in.The iPhone 6s Plus enclosure is made from the same grade used in the aerospace industry. This aluminium is created from a unique composition of elements that make it the strongest alloy we’ve ever used in an iPhone.They come in Perfect sizes. And perfect.iPhone 6s Plus have stunning Retina HD displays. No matter which size you choose, your apps, photos and just about everything else will look vibrant and sharp. High-contrast, dual-domain pixels, and accurate colours ensure that whatever’s on your screen, you’ll love what you see.3D TouchiPhone 6s Plus was designed specifically to work with 3D Touch, the next generation of Multi-Touch. 3D Touch is a revolutionary pressure‑sensing technology that lets you get to the content you want simply by pressing the display. Capacitive sensors measure the pressure you apply on the glass. You instantly see a response on the screen and feel feedback from the all‑new Taptic Engine. 3D Touch is a perfect example of the magic that happens when hardware and software are designed together. 3D Touch can only perform because it was designed alongside iPhone 6s Plus.Touch IDPlace your ﬁnger on the Home button, and just like that your iPhone unlocks. Touch ID is just as secure as before and now works even faster. You can use it within participating apps to sign in and authenticate purchases.A9 chipThe A9 chip is made speciﬁcally for iPhone. By designing our own chip, we can tailor its performance to how people really use their iPhone. So the things you do every day — browsing the web, using apps, taking photos — work even better. This level of integration between the A9 chip and iOS 9 means that your iPhone performs better and works more eﬃciently than if we used an off-the-shelf chip that we didn’t design.Your iPhone is beautiful. Give it a complement.We take great care in designing every aspect of iPhone 6s Plus, including the cases and accessories. Choose a natural leather case in one of ﬁve colours, or go with vibrant silicone in one of 11 colours. And to keep you charged at home, there are now colour‑matched Apple‑designed metal docks.12MP pictures. 4K videos. Live Photos. Lasting memories.People love to take pictures with iPhone. In fact, it’s the most popular camera in the world. But what people love even more are the memories that are preserved within those images. Those memories are now incredibly vivid with Live Photos, an entirely new way to bring your still photos to life.Lights. 4K camera. Action.The game-winning shot. The impromptu dance party. The first ride without stabilisers. Some things are meant for video. Now you can record those moments in resolution that’s four times higher than HD video. You can zoom in on those 8 million pixels while you’re shooting or playing your 4K videos. And with iPhone 6s Plus, optical image stabilisation is now available for videos in addition to photos. So you can shoot smooth, beautiful videos in lower light.Deeply powerful.The innovation begins from within. At every possible opportunity, iPhone 6s Plus has been engineered to work better. More intuitively. And more eﬃciently. iPhone 6s Plus also introduces groundbreaking new technologies, including 3D Touch and Live Photos.64-bit desktop-class architecture.The A9 chip is our third-generation chip with 64-bit architecture. It sits at the cutting edge of mobile chips, improving overall CPU performance by up to 70 per cent compared to the previous generation. And boosting graphics performance by up to a staggering 90 per cent compared to the previous generation.Ultra-fast wireless.Faster Wi‑Fi.iPhone 6s Plus lets you browse the web, download apps and games, and stay connected with the people who matter to you. And with iPhone 6s Plus, you can connect to more networks in more places for even better worldwide roaming. iPhone 6s Plus is also up to twice as fast when you’re connected to Wi‑Fi. And with Bluetooth technology, you’ll stay connected to your Apple Watch, external speakers and hundreds of other devices.*Touch ID. Advanced security.Right at your ﬁngertip.Touch ID lets you unlock your phone simply by using your ﬁngerprint. It uses highly sophisticated algorithms to recognise and securely match your ﬁngerprint. And the improved Touch ID sensor detects your ﬁngerprint even faster than the previous generation.Software and hardware. A deeper connection.If iPhone 6s Plus seems like it’s tailor‑made for iOS, that’s because it is. Each hardware component — from the A9 chip to the Home button — is designed to get the most out of iOS. And likewise, iOS is designed to maximise the performance and functionality of the hardware it runs on. Together, they deliver a powerful and enjoyable experience because they were designed that way — together.The new standard in phone photography comes as standard.iPhone 6s Plus introduces a next-generation, Apple-designed image signal processor to provide better temporal and spatial noise reduction as well as third-generation local tone mapping. Every pixel in the sensor has been re-engineered to prevent crosstalk between the subpixels, meaning we could fit a lot more pixels in the sensor for a sharper photo that has less noise and truer colour. iPhone 6s Plus features optical image stabilisation for videos in addition to photos, so you can get great shots in low light.","12MP primary camera with auto focus, 4K video recording, flash and 5MP front facing camera","5.5-inch (13.97 centimeters) Retina HD 3D-touch capacitive touchscreen with 1920 x 1080 pixels resolution and 401 ppi pixel density","iOS v9 operating system with A9 chip 64-bit architecture processor, 2GB RAM, 16GB internal memory and single nano SIM","Lithium-ion battery providing talk-time of 24 hours on 3G networks and standby time of 384 hours","1 year manufacturer warranty for device and 6 months manufacturer warranty for in-box accessories including batteries from the date of purchase","http://ecx.images-amazon.com/images/I/41O1YpRjEKL._SX38_SY50_CR,0,0,38,50_.jpg","http://ecx.images-amazon.com/images/I/419LGxeov7L._SX38_SY50_CR,0,0,38,50_.jpg","http://ecx.images-amazon.com/images/I/41rSUkyV4QL._SX38_SY50_CR,0,0,38,50_.jpg","http://ecx.images-amazon.com/images/I/41jqMNgg3gL._SX38_SY50_CR,0,0,38,50_.jpg","NA","Electronics","Mobiles & Accessories","Smartphones & Basic Mobiles","Smartphones","NA",
"http://www.amazon.in/Moto-Plus-4th-Gen-Black/dp/B01DDP87N0/ref=sr_1_32?s=electronics&ie=UTF8&qid=1498375560&sr=1-32&keywords=iphone+6","Moto G Plus, 4th Gen (Black, 16 GB)","13,499.00","10,999.00","FREE Delivery","Darshita Electronics","NA","Colour:Black  |  Size name:16 GBNow get the latest Andriod 7.0 Nougat on Moto G4 and Moto G4 PlusINSTRUCTIONSFor a successful installation, we recommend installing this update when the battery in your phone is at least 50% charged and you are connected to a Wi-Fi network.If you have received a notification message for this update:Select Yes, I'm in.After the software is downloaded, select Install now.After the software is installed, your phone will re-start automatically.Your phone is now updated.If you have not received a notification message for this update, follow the steps below to manually update your phone:Select the Settings icon in the apps menu.Select About phone.Select System updates.Select Yes, I'm in. After the software is downloaded, select Install now.After the software is installed, your phone will re-start automatically.Your phone is now updated.Click to know more - https://motorola-mobility-en-in.custhelp.com/app/answers/prod_answer_detail/a_id/115401","16 MP primary camera with laser focus, PDAF and professional mode, 5 MP wide angle front camera with display flash","Finger print reader for fast unlocking, 13.97 centimeters (5.5-inch) full HD display, 1920 x 1080 pixels resolution and 401 ppi pixel density, Corning Gorilla Glass 3","Android v6.0.1 Marshmallow OS with Motorola mobile computing system, including 1.5 GHz MSM8952 Qualcomm Snapdragon 617 octa-core processor with 550 MHz Adreno 405 GPU, 2GB RAM, 16GB internal memory expandable up to 128GB and dual micro-SIM dual-standby (4G+3G)","3000 mAh all day battery with TurboPower charging (6 hours of power in 15 min of charging)","1 year manufacturer warranty for device and 6 months manufacturer warranty for in-box accessories including batteries from the date of purchase","http://ecx.images-amazon.com/images/I/41kuuph1kIL._SX38_SY50_CR,0,0,38,50_.jpg","http://ecx.images-amazon.com/images/I/31wvDaes8sL._SX38_SY50_CR,0,0,38,50_.jpg","http://ecx.images-amazon.com/images/I/31eUUSI1vUL._SX38_SY50_CR,0,0,38,50_.jpg","http://ecx.images-amazon.com/images/I/212rhl-EGBL._SX38_SY50_CR,0,0,38,50_.jpg","http://ecx.images-amazon.com/images/I/41oOvhucsgL._SX38_SY50_CR,0,0,38,50_.jpg","Electronics","Mobiles & Accessories","Smartphones & Basic Mobiles","Smartphones","NA",
"http://www.amazon.in/Coolpad-Note5-Lite-3505I-Space/dp/B01N0SI0TB/ref=sr_1_33?s=electronics&ie=UTF8&qid=1498375560&sr=1-33&keywords=iphone+6","Coolpad Note 5 Lite (Space Grey, 3GB RAM + 16 GB)","8,999.00","NA","FREE Delivery","AMAZING MOBILES","NA","NA","13MP primary camera with auto focus, pro mode, HDR mode, beautification and 8MP front facing camera","12.7 centimeters (5-inch) capacitive touchscreen with 1280 x 720 pixels resolution","Android v6.0 Marshmallow + Cool UI 8.0 operating system with 1GHz MT6735CP Mediatek quad core processor, 3GB RAM, 16 GB internal memory expandable up to 64GB and dual SIM (nano+nano(hybrid)) dual-standby (4G+4G)","2500mAH lithium-ion battery and standby time of 200 hours","1 year manufacturer warranty for device and 6 months manufacturer warranty for in-box accessories including batteries from the date of purchase","http://ecx.images-amazon.com/images/I/41WWxRBNkgL._SX38_SY50_CR,0,0,38,50_.jpg","http://ecx.images-amazon.com/images/I/41ZuAANQ9WL._SX38_SY50_CR,0,0,38,50_.jpg","http://ecx.images-amazon.com/images/I/417lc18zXkL._SX38_SY50_CR,0,0,38,50_.jpg","http://ecx.images-amazon.com/images/I/31OXC9eXbzL._SX38_SY50_CR,0,0,38,50_.jpg","http://ecx.images-amazon.com/images/I/21TtTUuJJ-L._SX38_SY50_CR,0,0,38,50_.jpg","Electronics","Mobiles & Accessories","Smartphones & Basic Mobiles","Smartphones","NA",
"http://www.amazon.in/Honor-6X-Grey-32GB/dp/B01FM7JGT6/ref=sr_1_34?s=electronics&ie=UTF8&qid=1498375560&sr=1-34&keywords=iphone+6","Honor 6X (Grey, 32GB)","12,999.00","11,999.00","FREE Delivery","Rocket Kommerce LLP","NA","NA","12MP+2MP dual lens primary camera with auto focus camera, FF camera and 8MP front facing camera with PDAF Focusing","13.97 centimeters (5.5-inch) LCD LTPS/a-si capacitive touchscreen with 1920 x 1080 pixels resolution, 403 ppi pixel density and 16M color support","Android EMUI4.1 v 6.0.1 Marshmallow operating system with 2.1GHz + 1.7GHz Kirin 655 octa core processor, 3GB RAM, 32GB internal memory expandable up to 128GB and dual SIM dual-standby (4G+4G) with VoLte support","User can use any SIM slot for 4G (In-fact he can insert two 4G SIM cards in both the slots), Based on which SIM he choose for Data Connection, other SIM goes onto 2G for Voice.","3340mAH lithium-polymer battery providing talk-time of 23 hours and standby time of 650 hours","http://ecx.images-amazon.com/images/I/51yk3PMJNfL._SX38_SY50_CR,0,0,38,50_.jpg","http://ecx.images-amazon.com/images/I/3198ITU51oL._SX38_SY50_CR,0,0,38,50_.jpg","http://ecx.images-amazon.com/images/I/41-9bDR8m1L._SX38_SY50_CR,0,0,38,50_.jpg","http://ecx.images-amazon.com/images/I/31wH7fXXpML._SX38_SY50_CR,0,0,38,50_.jpg","http://ecx.images-amazon.com/images/I/21xfnUZbSFL._SX38_SY50_CR,0,0,38,50_.jpg","Electronics","Mobiles & Accessories","Smartphones & Basic Mobiles","Smartphones","NA",
"http://www.amazon.in/Moto-Plus-4th-Gen-Black/dp/B01DDP7GZK/ref=sr_1_35?s=electronics&ie=UTF8&qid=1498375560&sr=1-35&keywords=iphone+6","Moto G Plus, 4th Gen (Black, 32 GB)","15,999.00","13,699.00","FREE Delivery","Darshita Electronics","NA","Colour:Black  |  Size name:32 GB16 MP f/2.0 primary camera with laser auto focus and 4X digital zoom,5 MP wide angle front camera with display flash.13.97 centimeters (5.5-inch) full HD display 1920 x 1080 pixels resolution and 401 ppi pixel density, Corning Gorilla Glass 3. Android v6.0.1 Marshmallow operating system with 1.5GHz MSM8952 Qualcomm SnapdragonTM 617 octa core processor,550 Mhz Adreno 405 GPU, 3GB RAM, 32GB internal memory expandable up to 128GB and dual standby micro SIM (4G+3G). 3000 mAh all day battery with TurboPower charging.Now get the latest Andriod 7.0 Nougat on Moto G4 and Moto G4 PlusINSTRUCTIONSFor a successful installation, we recommend installing this update when the battery in your phone is at least 50% charged and you are connected to a Wi-Fi network.If you have received a notification message for this update:Select Yes, I'm in.After the software is downloaded, select Install now.After the software is installed, your phone will re-start automatically.Your phone is now updated.If you have not received a notification message for this update, follow the steps below to manually update your phone:Select the Settings icon in the apps menu.Select About phone.Select System updates.Select Yes, I'm in. After the software is downloaded, select Install now.After the software is installed, your phone will re-start automatically.Your phone is now updated.Click to know more - https://motorola-mobility-en-in.custhelp.com/app/answers/prod_answer_detail/a_id/115401","16 MP primary camera with laser focus, PDAF and Professional mode, 5 MP wide angle front camera with display flash","Finger print reader for fast unlocking, 13.97 centimeters (5.5-inch) full HD display, 1920 x 1080 pixels resolution and 401 ppi pixel density, Corning Gorilla Glass 3","Android v6.0.1 Marshmallow operating system (upgradable to 7.0 (Nougat)) with Motorola mobile computing system, including 1.5 GHz MSM8952 Qualcomm® SnapdragonTM 617 octa-core processor with 550 MHz Adreno 405 GPU, 3GB RAM, 32GB internal memory expandable up to 128GB and dual micro-SIM dual-standby (4G+3G)","3000 mAh all day battery with TurboPower charging (6 hours of power in 15 min of charging)","1 year manufacturer warranty for device and 6 months manufacturer warranty for in-box accessories including batteries from the date of purchase","http://ecx.images-amazon.com/images/I/41kuuph1kIL._SX38_SY50_CR,0,0,38,50_.jpg","http://ecx.images-amazon.com/images/I/31wvDaes8sL._SX38_SY50_CR,0,0,38,50_.jpg","http://ecx.images-amazon.com/images/I/31eUUSI1vUL._SX38_SY50_CR,0,0,38,50_.jpg","http://ecx.images-amazon.com/images/I/212rhl-EGBL._SX38_SY50_CR,0,0,38,50_.jpg","http://ecx.images-amazon.com/images/I/41oOvhucsgL._SX38_SY50_CR,0,0,38,50_.jpg","Electronics","Mobiles & Accessories","Smartphones & Basic Mobiles","Smartphones","NA",
"http://www.amazon.in/Apple-iPhone-6s-Rose-Gold/dp/B016QBTFZC/ref=sr_1_36?s=electronics&ie=UTF8&qid=1498375560&sr=1-36&keywords=iphone+6","Apple iPhone 6s (Rose Gold, 16GB)","NA","34,990.00","FREE Delivery","TECHOHOLIC","NA","Colour:Rose GoldProduct descriptionAppleFrom the ManufacturerA breakthrough design. Pushed even further.iPhone 6s - Take everything that made the previous generation great, and advance it to a new level. They’re made with 7000 Series aluminium, the strongest alloy we’ve ever used in an iPhone. They both feature Retina HD displays made from the strongest cover glass used on any smartphone in the world. And now they’re available in an elegant new rose gold ﬁnish.Sleek and seamless, in four gorgeous ﬁnishes.The smooth, continuous unibody design created for iPhone 6 comes to iPhone 6s. Its familiar form feels just right in your hand. And now there are four stunning ﬁnishes to choose from: gold, silver, space grey, and the new rose gold.The world’s strongest smartphone glass. Now even stronger.The new glass on iPhone 6s is made using a special dual ion‑exchange process, which makes it stronger at a molecular level and the most durable in the smartphone industry.7000 Series aluminium. Stronger from the outside in.The iPhone 6s enclosure is made from the same grade used in the aerospace industry. This aluminium is created from a unique composition of elements that make it the strongest alloy we’ve ever used in an iPhone.They come in Perfect sizes. And perfect.iPhone 6s have stunning Retina HD displays. No matter which size you choose, your apps, photos and just about everything else will look vibrant and sharp. High-contrast, dual-domain pixels, and accurate colours ensure that whatever’s on your screen, you’ll love what you see.3D TouchiPhone 6s was designed specifically to work with 3D Touch, the next generation of Multi-Touch. 3D Touch is a revolutionary pressure‑sensing technology that lets you get to the content you want simply by pressing the display. Capacitive sensors measure the pressure you apply on the glass. You instantly see a response on the screen and feel feedback from the all‑new Taptic Engine. 3D Touch is a perfect example of the magic that happens when hardware and software are designed together. 3D Touch can only perform because it was designed alongside iPhone 6s.Touch IDPlace your ﬁnger on the Home button, and just like that your iPhone unlocks. Touch ID is just as secure as before and now works even faster. You can use it within participating apps to sign in and authenticate purchases.A9 chipThe A9 chip is made speciﬁcally for iPhone. By designing our own chip, we can tailor its performance to how people really use their iPhone. So the things you do every day — browsing the web, using apps, taking photos — work even better. This level of integration between the A9 chip and iOS 9 means that your iPhone performs better and works more eﬃciently than if we used an off-the-shelf chip that we didn’t design.Your iPhone is beautiful. Give it a complement.We take great care in designing every aspect of iPhone 6s, including the cases and accessories. Choose a natural leather case in one of ﬁve colours, or go with vibrant silicone in one of 11 colours. And to keep you charged at home, there are now colour‑matched Apple‑designed metal docks.12MP pictures. 4K videos. Live Photos. Lasting memories.People love to take pictures with iPhone. In fact, it’s the most popular camera in the world. But what people love even more are the memories that are preserved within those images. Those memories are now incredibly vivid with Live Photos, an entirely new way to bring your still photos to life.Lights. 4K camera. Action.The game-winning shot. The impromptu dance party. The first ride without stabilisers. Some things are meant for video. Now you can record those moments in resolution that’s four times higher than HD video. You can zoom in on those 8 million pixels while you’re shooting or playing your 4K videos.Deeply powerful.The innovation begins from within. At every possible opportunity, iPhone 6s has been engineered to work better. More intuitively. And more eﬃciently. iPhone 6s also introduces groundbreaking new technologies, including 3D Touch and Live Photos.64-bit desktop-class architecture.The A9 chip is our third-generation chip with 64-bit architecture. It sits at the cutting edge of mobile chips, improving overall CPU performance by up to 70 per cent compared to the previous generation. And boosting graphics performance by up to a staggering 90 per cent compared to the previous generation.Ultra-fast wireless.Faster Wi‑Fi.iPhone 6s lets you browse the web, download apps and games, and stay connected with the people who matter to you. And with iPhone 6s, you can connect to more networks in more places for even better worldwide roaming. iPhone 6s is also up to twice as fast when you’re connected to Wi‑Fi. And with Bluetooth technology, you’ll stay connected to your Apple Watch, external speakers and hundreds of other devices.*Touch ID. Advanced security.Right at your ﬁngertip.Touch ID lets you unlock your phone simply by using your ﬁngerprint. It uses highly sophisticated algorithms to recognise and securely match your ﬁngerprint. And the improved Touch ID sensor detects your ﬁngerprint even faster than the previous generation.Software and hardware. A deeper connection.If iPhone 6s seems like it’s tailor‑made for iOS, that’s because it is. Each hardware component — from the A9 chip to the Home button — is designed to get the most out of iOS. And likewise, iOS is designed to maximise the performance and functionality of the hardware it runs on. Together, they deliver a powerful and enjoyable experience because they were designed that way — together.The new standard in phone photography comes as standard.iPhone 6s introduces a next-generation, Apple-designed image signal processor to provide better temporal and spatial noise reduction as well as third-generation local tone mapping. Every pixel in the sensor has been re-engineered to prevent crosstalk between the subpixels, meaning we could fit a lot more pixels in the sensor for a sharper photo that has less noise and truer colour. iPhone 6s features optical image stabilisation for videos in addition to photos, so you can get great shots in low light.","12MP primary camera with auto focus, 4K video recording, flash and 5MP front facing camera","4.7-inch (11.4 centimeters) Retina HD 3D-touch capacitive touchscreen with 1334 x 750 pixels resolution and 326 ppi pixel density","iOS v9 operating system with A9 chip 64-bit architecture processor, 2GB RAM, 16GB internal memory and single nano SIM","Lithium-ion battery providing talk-time of 14 hours on 3G networks and standby time of 240 hours","1 year manufacturer warranty for device and 6 months manufacturer warranty for in-box accessories including batteries from the date of purchase","http://ecx.images-amazon.com/images/I/4174qk-98lL._SX38_SY50_CR,0,0,38,50_.jpg","http://ecx.images-amazon.com/images/I/41HxCUMaROL._SX38_SY50_CR,0,0,38,50_.jpg","http://ecx.images-amazon.com/images/I/41vME8It%2BSL._SX38_SY50_CR,0,0,38,50_.jpg","NA","NA","Electronics","Mobiles & Accessories","Smartphones & Basic Mobiles","Smartphones","NA",
