"https://www.snapdeal.com/product/dell-inspiron-3552-z565162hin9-notebook/620658456911","Dell Inspiron 15 3552 Notebook (Intel Pentium- 4GB RAM- 500GB HDD- 39.62cm (15.6)- DOS) (Black)","NA","Rs. 22,678","NA","ZRPL","10% Instant Discount Using HSBC Credit & Debit Cards T&C","Backed by powerful features and impressive design, the new Dell Inspiron 3552 Notebook (Z565162HIN9) in Black has it all to be your computing companion. The notebook has a sleek design which looks professional. Intel Pentium processor is installed in this laptop which is accompanied by a 4 GB RAM to provide smooth and jet speed performance. With 500 GB SATA HDD, the storage space of this notebook is sufficient to save countless movies, songs and documents all together. The 39.62 cm (15.6) screen of the laptop offers unparalleled movie watching experience.","Warranty Period:1 Year","Usage:Home","Resolution:1366x768 (WXGA)","Base Clock Speed (in GHz):1.6","Backlit Keyboard:No","https://n3.sdlcdn.com/imgs/c/v/o/Dell-Inspiron-3552-Z565162HIN9-Notebook-SDL702490147-1-9b19a.jpg","https://n3.sdlcdn.com/imgs/c/v/o/Dell-Inspiron-3552-Z565162HIN9-Notebook-SDL702490147-2-93243.jpg","https://n1.sdlcdn.com/imgs/c/v/o/Dell-Inspiron-3552-Z565162HIN9-Notebook-SDL702490147-3-73701.jpg","https://n3.sdlcdn.com/imgs/c/v/o/Dell-Inspiron-3552-Z565162HIN9-Notebook-SDL702490147-4-019c0.jpg","https://n2.sdlcdn.com/imgs/c/v/o/Dell-Inspiron-3552-Z565162HIN9-Notebook-SDL702490147-5-08597.jpg","Computers & Peripherals","Laptops","NA","NA","NA","NA","NA","NA","NA","16:9","NA","No","1.6","Upto 6 hours","NA","4 Cells","NA","Li-ion","NA","NA","v4.0","NA","Dell","2.4","NA","NA","NA","2 MB (L2 Cache)","NA","NA","NA","NA","NA","NA","NA","NA","Black","NA","NA","NA","NA","NA","Not Applicable","NA","Not Applicable","NA","NA","NA","NA","NA","NA","NA","No","NA","Not Applicable","NA","NA","NA","NA","NA","Intel HD Graphics","5400 RPM","NA","Yes","NA","500 GB","NA","NA","NA","Single Combo Jack","NA","Laptop, Battery, AC Adaptor, User Guide and Manuals","NA","NA","NA","64 bit","NA","NA","Yes","NA","Standard Keyboard without Numpad","NA","No","NA","NA","260","Kensington Lock Slot","NA","NA","NA","NA","NA","NA","NA","NA","NA","NA","3552 (Z565162HIN9)","NA","NA","Yes","NA","NA","NA","NA","NA","NA","NA","NA","NA","DOS","DVD R/W","NA","NA","NA","NA","NA","NA","NA","NA","Intel","NA","Intel Pentium","NA","NA","NA","NA","NA","NA","NA","4 GB","NA","1 (Unused - 0)","DDR3","NA","NA","8x","1366x768 (WXGA)","Not Applicable","NA","39.62cm(15.6)","Truelife LED-Backlit","Inspiron","NA","NA","Waves MaxxAudio pro","2 Tunes Speakers","NA","NA","NA","NA","HDD","NA","21.7","NA","No","Yes","Notebook","NA","2","NA","1","None","NA","None","Home","NA","NA","No","NA","N3700","NA","NA","1 Year","NA","NA","Onsite Warranty","1.3 MP (HD)","NA","2.1","802.11bgn","NA","380","NA","NA","Not Applicable",
"https://www.snapdeal.com/product/dell-inspiron-5558-notebook-5th/626014663861","Dell Inspiron 5558 Notebook (5th Gen Core i5-5200U- 8GB RAM- 1TB HDD- 39.6 cm (15.6)- Windows 8.1- 2GB Graphics) (White)","NA","Rs. 49,990","NA","Technogenie","10% Instant Discount Using HSBC Credit & Debit Cards T&C","The images represent actual product though color of the image and product may slightly differ.","Processor: 5th Generation Intel Core i5-5200U","Memory (RAM): 8 GB","Hard Disk Capacity: 1 TB","Screen Size: 39.62 cm (15.6)","Type: Notebook","https://n2.sdlcdn.com/imgs/a/7/j/Dell-Inspiron-5558-Notebook-5th-SDL900290333-1-dff5e.jpg","https://n3.sdlcdn.com/imgs/a/7/j/Dell-Inspiron-5558-Notebook-5th-SDL900290333-2-a26cd.jpg","https://n1.sdlcdn.com/imgs/a/7/j/Dell-Inspiron-5558-Notebook-5th-SDL900290333-3-4197b.jpg","https://n1.sdlcdn.com/imgs/a/7/j/Dell-Inspiron-5558-Notebook-5th-SDL900290333-4-b75f0.jpg","https://n3.sdlcdn.com/imgs/a/7/j/Dell-Inspiron-5558-Notebook-5th-SDL900290333-5-b585c.jpg","Computers & Peripherals","Laptops","NA","NA","NA","NA","NA","NA","64-bit","NA","NA","NA","NA","NA","NA","NA","NA","NA","NA","NA","v4.0","NA","Dell","NA","NA","NA","NA","3 MB","NA","NA","NA","NA","NA","NA","NA","2.2 GHz (2.7 GHz Max Turbo Frequency)","White","NA","NA","NA","NA","NA","NA","2 GB","DDR3","NA","NA","NA","NA","345 x 243 x 23.35 mm","NA","10/100 RJ-45 Ethernet network","NA","NA","NA","NA","NVIDIA GeForce 920M","NA","NA","NA","NA","NA","NA","HDMITM 1.4a","NA","1 TB","NA","SATA","NA","NA","NA","NA","NA","NA","NA","NA","Integrated Widescreen HD (720p) Webcam","NA","Yes","NA","Standard Keyboard","NA","No","NA","NA","NA","Kensington Lock Slot","NA","NA","NA","2","NA","NA","NA","NA","NA","NA","5558","NA","NA","Media Card (SD, SDHC, SDXC)","NA","NA","NA","NA","Please use invoice to register the product on brand website within 30 days of purchase for hassle free service","NA","NA","NA","NA","Windows 8.1","Yes","NA","NA","NA","NA","NA","NA","Touchpad","NA","Intel","NA","5th Gen Core i5","NA","NA","NA","NA","NA","NA","NA","8 GB DDR3","NA","NA","NA","Yes","5400","8x","1366 x 768","NA","Laptop, Battery, AC Adaptor, User Guide and Manuals","39.62 cm (15.6)","Truelife LED-Backlit Display (HDLCD)","Inspiron","NA","NA","Waves MaxxAudio 4","Stereo Speakers","NA","NA","4 Cell (Li-ion)","NA","NA","NA","NA","NA","NA","NA","Notebook","NA","NA","NA","NA","NA","1 x USB 3.0, 2 x USB 2.0","NA","NA","Everyday Use","NA","NA","NA","5200U","NA","NA","2 Year Dell Onsite Warranty","NA","NA","NA","NA","NA","NA","NA","NA","NA","802.11ac","NA","NA",
"https://www.snapdeal.com/product/dell-inspiron-15-3542-notebook/2055515519","Dell Inspiron 15 3542 Notebook (Intel Pentium- 4GB RAM- 500GB- 39.62cm (15.6)- Windows 8.1) (Black)","NA","Rs. 26,999","NA","JE Tech Stores","10% Instant Discount Using HSBC Credit & Debit Cards T&C","Work hard and party harder with the Dell Inspiron 15 3542 Notebook brought to you by Dell, the leaders of laptop innovation. This stylish, black notebook is available on Snapdeal along with a one year Dell India Complete Cover Warranty. The notebook works on a Pentium Dual Core (4th Generation) processor with a HM87 chipset, a speed of 1.7 GHz and a cache of 2 MB. The hard-disk, capacity with SATA hardware interface, has a storage capacity of 500 MB. That along with the RAM of 4 GB and an expandable memory of up to 8 GB gives you all the space you need to save all your important work and files in one place. This notebook also has a Tray-load DVD RW Drive to read/ write DVDs. The operating system for this laptop is Windows 8.1, guaranteeing a user interface that you will maneuver with absolute ease. The size of the screen is 39.62 cm so you always see the big picture. With a display resolution of 1366 x 768 Pixels, you’ll never strain your eyes to figure out visuals. The notebook has an HD LED Backlit Display with True Life that gives you the best quality imagery in the brightest/ darkest lighting conditions. Intel HD Graphics processor maintains the performance of graphic flow in the system. This notebook also has a 720p HD Webcam for clear-cut videos/ images / conversations with loved ones. The notebook gives you a touchpad for navigation and a standard QWERTY keyboard for typing. There are also two tuned speakers with Waves MaxxAudio, to give you finely tuned, highly defined audio. Connectivity with anyone, anywhere is not a problem with three connectivity options- 10/100 Ethernet LAN Port, Dell Wireless N 1705 LAN and Bluetooth (v4.0). This notebook has a standard 4-cell battery and multiple ports/ slots to connect to other systems/ devices you may want to use. The best part about this laptop is that it is compact and light (2.16 kg). The Dell Inspiron 15 3542 Notebook is available at the best possible price on Snapdeal.","Memory (Ram) : 4 GB","Type : Notebook","Operating System : Windows 8.1","Processor Name : Pentium Dual Core (4th Generation)","Hard Disk Capacity : 500 GB","https://n3.sdlcdn.com/imgs/a/j/0/Dell-Inspiron-15-3542-Notebook-SDL568655634-1-5c843.jpg","https://n2.sdlcdn.com/imgs/a/j/0/Dell-Inspiron-15-3542-Notebook-SDL568655634-2-09370.jpg","https://n3.sdlcdn.com/imgs/a/j/0/Dell-Inspiron-15-3542-Notebook-SDL568655634-3-bdacc.jpg","https://n4.sdlcdn.com/imgs/b/k/6/sdl568655634_5-25d8d.JPG","NA","Computers & Peripherals","Laptops","NA","NA","NA","NA","NA","NA","64 bit","NA","NA","NA","NA","NA","NA","NA","NA","NA","NA","NA","v4.0","NA","Dell","NA","NA","NA","NA","2 MB","NA","NA","NA","NA","NA","NA","HM87","1.7 GHz","Black","NA","NA","NA","NA","NA","NA","NA","NA","NA","NA","NA","NA","381.4 x 267.6 x 26.6 mm","NA","10/100 LAN","NA","Upto 8 GB","NA","NA","Intel HD Graphics","NA","NA","NA","NA","NA","NA","Yes","NA","500 GB","NA","SATA","NA","NA","NA","NA","NA","NA","NA","NA","720p HD Webcam","NA","Yes","NA","Standard Keyboard","NA","NA","NA","NA","NA","Kensington Lock Slot","NA","NA","NA","1 (Unused Slot - 0)","Yes","NA","NA","NA","NA","NA","3542","NA","NA","3-in-1 Card Reader","NA","NA","Brand does not take the responsibility of any damage caused on the laptop due to third party software installed by the customer which enhances the performance of specific parts such as Audio, Battery, RAM, etc.","NA","NA","NA","NA","NA","NA","Windows 8.1","Tray-load DVD RW Drive","NA","NA","NA","NA","NA","NA","Touchpad","40 W AC Adapter","Intel","NA","Pentium Dual Core (4th Generation)","NA","NA","NA","NA","NA","NA","NA","4 GB","NA","NA","NA","Yes","5400","NA","1366 x 768 Pixels","NA","Laptop, Battery, AC Adapter, User Guide, Manual","39.62cm (15.6)","HD LED Backlit Display with True Life","Inspiron 15","NA","NA","2 Tuned Speakers with Waves MaxxAudio","Yes","NA","NA","4-cell","NA","NA","NA","NA","NA","NA","NA","Notebook","NA","NA","NA","NA","NA","2 x USB 2.0, 1 x USB 3.0","NA","NA","Everyday Use","NA","NA","NA","3558U","NA","NA","1 Year Dell India Complete Cover Warranty","NA","NA","NA","NA","2.16 kg","NA","NA","NA","NA","Dell Wireless N 1705","NA","NA",
"https://www.snapdeal.com/product/dell-inspiron-inspiron-5578-notebook/647192840031","Dell Inspiron 5578 2-in-1 (7th Gen Intel Core i5- 8GB RAM- 1TB HDD- 39.62cm(15.6) Windows 10 Touch & MS office) (Grey)","NA","Rs. 71,000","NA","IT_NXT","10% Instant Discount Using HSBC Credit & Debit Cards T&C","The images represent actual product though color of the image and product may slightly differ.","Warranty Period:1 Year","Usage:Business","Resolution:1920x1080 (Full HD)","Base Clock Speed (in GHz): 2.5","Backlit Keyboard:Yes","https://n1.sdlcdn.com/imgs/c/0/d/Dell-Inspiron-Inspiron-5578-Notebook-SDL179830484-1-9d8ef.jpg","https://n2.sdlcdn.com/imgs/c/0/d/Dell-Inspiron-Inspiron-5578-Notebook-SDL179830484-2-2c06a.jpg","https://n3.sdlcdn.com/imgs/c/0/d/Dell-Inspiron-Inspiron-5578-Notebook-SDL179830484-3-6e782.jpg","https://n2.sdlcdn.com/imgs/c/0/d/Dell-Inspiron-Inspiron-5578-Notebook-SDL179830484-4-7df2b.jpeg","https://n3.sdlcdn.com/imgs/c/0/d/Dell-Inspiron-Inspiron-5578-Notebook-SDL179830484-5-8b47a.jpg","Computers & Peripherals","Laptops","NA","NA","NA","NA","NA","NA","NA","NA","NA","Yes","2.5","Upto 7 hours","NA","3 Cells","NA","Li-ion","NA","NA","v4.2","NA","Dell","3.1","NA","NA","NA","3 MB","NA","NA","NA","NA","NA","NA","NA","NA","Grey","NA","NA","NA","NA","NA","Not Applicable","NA","NA","NA","NA","NA","NA","NA","NA","NA","Not Applicable","NA","Upto 8 GB","NA","NA","NA","NA","NA","NA","5400 RPM","NA","Yes","NA","1 TB","NA","NA","NA","Single Combo Jack","NA","Laptop","NA","NA","NA","64 bit","NA","NA","Yes","NA","Standard Keyboard with Numpad","NA","No","NA","NA","253.8","Kensington Lock Slot","NA","NA","NA","NA","NA","NA","NA","NA","NA","NA","Inspiron 5578","NA","NA","Yes","NA","NA","NA","NA","NA","NA","NA","NA","NA","Windows 10 Home","NA","NA","NA","NA","NA","NA","NA","NA","NA","Intel","NA","Core i5 (7th Generation)","NA","NA","NA","NA","NA","NA","NA","8 GB","NA","1 (Unused - 0)","DDR4","NA","NA","NA","1920x1080 (Full HD)","Not Applicable","NA","39.62cm(15.6)","FHD","Inspiron","NA","NA","Waves Mex Audio pro","Yes","NA","NA","NA","NA","HDD","NA","20.2","NA","Yes","Yes (with Multi-touch Gesture Support)","Notebook","NA","1","NA","2","None","NA","None","Business","NA","NA","No","NA","7200u","NA","NA","1 Year","NA","NA","1Yr Premium Support: Onsite Service W/Accidental Damage","1.3 MP (HD)","NA","1.9","Yes 802.11ac","NA","381.9","NA","NA","Not Applicable",
"https://www.snapdeal.com/product/dell-inspiron-5559i581tb2gbw10bm-notebook-y566509hin9bm/677588309719","Dell Inspiron 5559 Notebook (6th Gen Intel Core i5- 8GB RAM- 1TB HDD- 39.62 cm (15.6)- Windows 10- 2GB Graphics) (Blue)","NA","Rs. 55,500","NA","JE Tech Stores","10% Instant Discount Using HSBC Credit & Debit Cards T&C","Designed for everyday computing use and high-end gaming applications, this Dell Inspiron notebook comes with the 6th generation Intel Core i5, 8 GB RAM, 1 TB hard disk drive, and Windows 10 operating system. The Intel Core i5 processor clubbed with 8 GB of RAM results in an efficient and smooth computing performance. The AMD Radeon R5 M335 helps to further boost the performance of the Dell notebook while running graphic-rich applications. This Dell device offers a variety of options to connect with other devices or the internet. It comes with 2 USB 2.0 ports and 1 USB 3.0 port, a HDMI port, 3-in-1 card reader slot, Bluetooth and Wi-Fi connectivity.","Processor: Intel Core i5 (6th Generation)-6200U","Memory (RAM): 8 GB","Hard Disk Capacity: 1 TB","Screen Size: 39.62 cm (15.6)","Type: Notebook","https://n2.sdlcdn.com/imgs/b/m/4/Dell-Inspiron-5559i581tb2gbw10BM-Notebook-Y566509HIN9BM-SDL105733223-1-29b69.jpg","https://n2.sdlcdn.com/imgs/b/m/4/Dell-Inspiron-5559i581tb2gbw10BM-Notebook-Y566509HIN9BM-SDL105733223-2-3df9c.jpg","https://n1.sdlcdn.com/imgs/b/m/4/Dell-Inspiron-5559i581tb2gbw10BM-Notebook-Y566509HIN9BM-SDL105733223-3-860dc.jpg","https://n3.sdlcdn.com/imgs/b/m/4/Dell-Inspiron-5559i581tb2gbw10BM-Notebook-Y566509HIN9BM-SDL105733223-4-afd6a.jpg","NA","Computers & Peripherals","Laptops","NA","NA","NA","NA","NA","NA","64 bit","NA","NA","NA","NA","Up to 7 hours","NA","NA","NA","NA","NA","NA","Bluetooth v4.0","NA","Dell","NA","NA","NA","NA","3 MB","NA","NA","NA","NA","NA","NA","NA","2.3 GHz with Turbo Boost upto 2.8 GHz","Blue Matt","NA","NA","NA","NA","NA","NA","2 GB","DDR3","NA","NA","NA","NA","NA","NA","Integrated 10/100 Ethernet LAN","NA","NA","NA","NA","AMD Radeon R5 M335","NA","NA","NA","NA","NA","NA","1 x HDMI Port","NA","1 TB","NA","SATA","NA","NA","NA","NA","NA","NA","NA","NA","0.9 Megapixel Webcam","NA","Dual Digital Microphone Array","NA","English keyboard without backlight","NA","No","NA","NA","NA","Kensington Lock Slot","NA","NA","NA","2","Yes","NA","NA","NA","NA","Inspiron 5559","NA","NA","NA","Media Card (SD, SDHC, SDXC)","NA","NA","NA","NA","Please use invoice to register the product on brand website within 30 days of purchase for hassle free service","NA","NA","NA","NA","Windows 10","CD/DVD writer","NA","NA","NA","NA","NA","NA","Multi-touch gesture-enabled pad with integrated scrolling","NA","Intel","NA","6th Gen Core i5","NA","NA","NA","NA","NA","NA","NA","8 GB DDR3","NA","NA","NA","NA","5400","8x","1366 x 768 Pixels","NA","Laptop, Battery, AC Adaptor, User Guide and Manuals","39.62 cm (15.6)","HD Truelife LED-Backlit Display","5559","NA","NA","Waves MaxxAudio 4","2 tuned speakers with Waves MaxxAudio processing","NA","NA","4 Cell Li-Ion","NA","NA","NA","NA","NA","NA","NA","Notebook","NA","NA","NA","NA","NA","2 x USB 2.0, 1 x USB 3.0","NA","NA","Gaming","NA","NA","NA","6200U","NA","NA","2 Years Dell Onsite Warranty","NA","NA","NA","NA","2.4 kg","NA","NA","NA","NA","802.11ac Dual Band 2.4 and 5 GHz","NA","NA",
"https://www.snapdeal.com/product/dell-new-inspiron-14-5459/631538489680","Dell Inspiron 14 5459 Notebook (Y566503HIN9BG) (6th Gen Intel Core i5- 8GB RAM- 1TB HDD- 35.81 cm (14.1)- Windows 10- 2GB Graphics) (Black)","NA","Rs. 53,990","NA","Amazing Deal","10% Instant Discount Using HSBC Credit & Debit Cards T&C","The images represent actual product though color of the image and product may slightly differ.","Processor: 6th Generation Intel Core i5-6200U","Memory (RAM): 8 GB","Hard Disk Capacity: 1 TB","Screen Size: 35.81 cm (14.1)","Type: Notebook","https://n4.sdlcdn.com/imgs/b/m/1/Dell-New-Inspiron-14-5459-SDL238835357-1-9ed75.jpg","https://n3.sdlcdn.com/imgs/b/m/1/Dell-New-Inspiron-14-5459-SDL238835357-2-cb735.jpg","https://n2.sdlcdn.com/imgs/b/m/1/Dell-New-Inspiron-14-5459-SDL238835357-3-743f0.jpg","https://n1.sdlcdn.com/imgs/b/m/1/Dell-New-Inspiron-14-5459-SDL238835357-4-11600.jpg","https://n2.sdlcdn.com/imgs/b/m/1/Dell-New-Inspiron-14-5459-SDL238835357-5-1bf25.jpg","Computers & Peripherals","Laptops","NA","NA","NA","NA","NA","NA","64-bit","NA","NA","NA","NA","Up to 7 Hours","NA","NA","NA","NA","NA","NA","v4.0","NA","Dell","NA","NA","NA","NA","3 MB","NA","NA","NA","NA","NA","NA","NA","up to 2.70 GHz","Black Gloss","NA","NA","NA","NA","NA","NA","2 GB","DDR3","NA","NA","NA","NA","345 x 243 x 23.35 mm","NA","NA","NA","NA","NA","NA","AMD Radeon R5 M335","NA","NA","NA","NA","NA","NA","NA","NA","1 TB","NA","SATA","NA","NA","NA","NA","NA","NA","NA","NA","0.9 MP Webcam","NA","Yes","NA","Standard Keyboard","NA","No","NA","NA","NA","Kensington Lock Slot","NA","NA","NA","2","Yes","NA","NA","NA","NA","NA","5459 (Y566503HIN9BG)","NA","NA","SD, SDHC, SDXC","NA","NA","NA","NA","Please use invoice to register the product on brand website within 30 days of purchase for hassle free service","NA","NA","NA","NA","Windows 10","CD/DVD Writer","NA","NA","NA","NA","NA","NA","Touchpad","NA","Intel","NA","Core i5 (6th Generation)","NA","NA","NA","NA","NA","NA","NA","8 GB","NA","NA","NA","NA","5400","8x","1366 x 768 Pixels","NA","Laptop, Battery, AC Adaptor, User Guide and Manuals","35.81 cm (14.1)","LED Backlit Display with Truelife and HD resolution","New Inspiron 14 5000","NA","NA","Waves MaxxAudio 4","2 Tuned Speakers with Waves MaxxAudio Processing","NA","NA","4 Cells Li-Ion","NA","NA","NA","NA","NA","NA","NA","Notebook","NA","NA","NA","NA","NA","2 x USB 2.0, 1 x USB 3.0","NA","NA","Gaming","NA","NA","NA","6200U","NA","NA","2 Years Dell Onsite Warranty","NA","NA","NA","NA","2.4 kg","NA","NA","NA","NA","802.11ac","NA","NA",
"https://www.snapdeal.com/product/dell-inspiron-15-3542-notebook/1992581154","Dell Inspiron 15 3542 Notebook (Intel Celeron 2957U- 4GB RAM- 500GB HDD- 39.62cm (15.6) Screen- DOS) (Black)","NA","Rs. 26,999","NA","JE Tech Stores","10% Instant Discount Using HSBC Credit & Debit Cards T&C","Those who wish to speed up their computing tasks with a multi functional laptop can take a look at Dell Inspiron 15 3542. Black in colour, this laptop measures 381.4 x 267.6 x 26.6 mm. It has a touchpad, stereo speakers, a slim design and a standard keyboard for an extra smooth and easy input. This laptop also has a long battery life that will last for a sufficient time period. The DOS operating system makes it very efficient to use and will not lag.","Type: Notebook","Processor: 4th Gen Intel Celeron Dual Core 2957U","Screen Size: 39.62cm (15.6) HD LED Backlit Display with True Life","Memory (RAM): 4 GB","Hard Disk Capacity: 500GB","https://n3.sdlcdn.com/imgs/a/o/w/Dell-Inspiron-15-3542-Notebook-SDL786951976-1-983d9.JPG","https://n1.sdlcdn.com/imgs/a/o/w/Dell-Inspiron-15-3542-Notebook-SDL786951976-2-d92a2.JPG","https://n2.sdlcdn.com/imgs/a/o/w/Dell-Inspiron-15-3542-Notebook-SDL786951976-3-626b6.JPG","NA","NA","Computers & Peripherals","Laptops","NA","NA","NA","NA","NA","NA","64 bit","NA","NA","NA","NA","NA","NA","NA","NA","NA","NA","NA","v4.0","NA","Dell","NA","NA","NA","NA","2 MB","NA","NA","NA","NA","NA","NA","HM87","1.4 GHz","Black","NA","NA","NA","NA","NA","NA","NA","NA","NA","NA","NA","NA","381.4 x 267.6 x 26.6 mm","NA","10/100 LAN","NA","Upto 8 GB","NA","NA","Intel HD Graphics 4400","NA","NA","NA","NA","NA","NA","Yes","NA","500 GB","NA","SATA","NA","NA","NA","NA","NA","NA","NA","NA","720p HD Webcam","NA","Yes","NA","Standard Keyboard","NA","NA","NA","NA","NA","Kensington Lock Slot","NA","NA","NA","1 (Unused Slot - 0)","Yes","NA","NA","NA","NA","NA","3542","NA","NA","3-in-1 Card Reader","NA","NA","NA","NA","NA","NA","NA","NA","NA","DOS","Tray-load DVD RW Drive","NA","NA","NA","NA","NA","NA","Touchpad","40 W AC Adapter","Intel","NA","Celeron Dual Core (4th Generation)","NA","NA","NA","NA","NA","NA","NA","4 GB","NA","NA","NA","Yes","5400","NA","1366 x 768 Pixels","NA","Laptop, Battery, AC Adapter, User Guide, Manual","39.62cm (15.6)","HD LED Backlit Display with True Life","3000 Series","NA","NA","2 Tuned Speakers with Waves MaxxAudio","Yes","NA","NA","4-cell","NA","NA","NA","NA","NA","NA","NA","Notebook","NA","NA","NA","NA","NA","2 x USB 2.0, 1 x USB 3.0","NA","NA","Everyday Use","NA","NA","NA","2957U","NA","NA","1 Year Dell India Complete Cover Warranty","NA","NA","NA","NA","2.16 kg","NA","NA","NA","NA","Dell Wireless N 1705","NA","NA",
"https://www.snapdeal.com/product/dell-inspiron-5559-notebook-y566513hin9/644841701857","Dell Inspiron 15 5559 Notebook (6th Gen Intel Core i7- 16GB RAM- 2TB HDD- 39.62 cm (15.6) Full HD- Windows 10- 4GB Graphics) (Silver)","NA","Rs. 79,363","NA","JE Tech Stores","10% Instant Discount Using HSBC Credit & Debit Cards T&C","Dell brings you Inspiron 5559 Notebook that provides you the best of both work and entertainment. The notebook features 6th Gen Intel Core i7 processor which assures lag-free performance when playing games and doing work simultaneously. It comes with 16 GB RAM which makes the real time running of different applications seamless. This laptop comes with 2 TB hard disk drive which will never let you delete your important files to store new. Screen size of 39.62 cm(15.6) makes the laptop compact and easy to carry. Further, the sleek professional design and classy silver colour are liked by one and all.","Processor: 6th Gen Intel Core i7-6500U","Memory (RAM): 16 GB","Hard Disk Capacity: 2 TB","Screen Size: 39.62 cm (15.6)","Type: Notebook","https://n4.sdlcdn.com/imgs/b/y/e/Dell-Inspiron-5559-Notebook-Y566513HIN9-SDL229516321-1-e9eff.jpg","https://n2.sdlcdn.com/imgs/b/y/e/Dell-Inspiron-5559-Notebook-Y566513HIN9-SDL229516321-2-c4ac3.jpg","https://n3.sdlcdn.com/imgs/b/y/e/Dell-Inspiron-5559-Notebook-Y566513HIN9-SDL229516321-3-3f2fa.jpg","https://n3.sdlcdn.com/imgs/b/y/e/Dell-Inspiron-5559-Notebook-Y566513HIN9-SDL229516321-4-4f285.jpg","https://n3.sdlcdn.com/imgs/b/y/e/Dell-Inspiron-5559-Notebook-Y566513HIN9-SDL229516321-5-6e2a2.jpg","Computers & Peripherals","Laptops","NA","NA","NA","NA","NA","NA","64 bit","NA","NA","NA","NA","NA","NA","NA","NA","NA","NA","NA","v4.0","NA","Dell","NA","NA","NA","NA","4 MB","NA","NA","NA","NA","NA","NA","NA","Up to 3.10 GHz","Silver","NA","NA","NA","NA","NA","NA","4 GB","DDR5","NA","NA","NA","NA","380 x 260.4 x 23.75 mm","NA","10/100 RJ-45 Ethernet network","NA","NA","NA","NA","NVIDIA GTX 960M","NA","NA","NA","NA","NA","NA","Yes","NA","2 TB","NA","SATA","NA","NA","NA","NA","NA","NA","NA","NA","Integrated Widescreen HD 720P","NA","Yes","NA","Standard Keyborad","NA","No","NA","NA","NA","Kensington Lock Slot","NA","NA","NA","NA","NA","NA","NA","NA","NA","NA","5559 (Y566513HIN9)","NA","NA","Media Card (SD, SDHC, SDXC)","NA","NA","NA","NA","Please use invoice to register the product on brand website within 30 days of purchase for hassle free service","NA","NA","NA","NA","Windows 10 Home Single Language","Tray load DVD Drive (Reads and Writes to DVD/CD)","NA","NA","NA","NA","NA","NA","Touchpad","NA","Intel","NA","Core i7 (6th Gen)","NA","NA","NA","NA","NA","NA","NA","16 GB DDR3L","NA","NA","NA","Yes","5400","8x","1920 x 1080 Pixels","NA","Laptop, Battery, AC Adaptor, User Guide and Manuals","39.62 cm (15.6)","FHD Anti-Glare LED-Backlit Display","Inspiron","NA","NA","Waves MaxxAudio 4","Stereo speakers","NA","NA","4-cell Li-ion","NA","NA","NA","NA","NA","NA","NA","Notebook","NA","NA","NA","NA","NA","2 x USB 2.0, 1 x USB 3.0","NA","NA","Gaming","NA","NA","NA","6500U","NA","NA","2 Years Dell Onsite Warranty","NA","NA","NA","NA","NA","NA","NA","NA","NA","802.11ac","NA","NA",
