Url,Title,MRP,Price,Shipping,Seller,Promo,Description,Highlight1,Highlight2,Highlight3,Highlight4,Highlight5,Image1,Image2,Image3,Image4,Image5,Category1,Category2,Category3,Category4,Category5,Adjustible Tilt, Ampiers, Anti Virus, Architecture, Aspect Ratio, Backlight Keyboard, Backlit Keyboard, Base Clock Speed (in GHz), Battery Backup, Battery Backup Time, Battery Cell, Battery Life, Battery Type, Battery life, Battery type, Bluetooth, Box Contents, Brand, Burst Clock Speed (in GHz), CPU/Tower, Cable Length of Keyboard, Cable Length of Mouse, Cache, Cache Memory, Cache Size, Capacity, Category, Cells, Charging Time, Chipset, Clock Speed, Color, Colour, Compatibility, Compatible Device Size, Complete list of Compatible Models, Connectivity, Dedicated Graphics Capacity, Dedicated Graphics Memory Capacity, Dedicated Graphics Memory Type, Dedicated Graphics Processor, Depth, Design Type, Dimension (W*D*H), Dimension(W*D*H), Dimension(WxDxH), Ethernet, Ethernet (RJ45 LAN Port), Expandable Memory, Expandable RAM, Expandable memory, Graphic Processor, Graphic card capacity, Graphic card processor, Graphic card type, Graphics Processor, HDD RPM, HDMI, HDMI Port, HDMI Ports, Hard Disk Capacity, Hard Disk Size, Hardware Interface, Headphone Jack, Headphone and Mic Combo Jack, Height, In The Box, In the box, Inbuilt Rechargable Battery, Included Software, Instruction Set, Integrated Camera, Interface, Internal Mic, Key Features, Keyboard, Keyboard Features, Laptop Bag/Backpack, Laptop Weight, Laptop compatibility, Length (in mm), Lock Port, Material, Memory Card Reader, Memory Slot, Memory Slots, Mic In, Mic-In, Microphone Jack, Model, Model Name, Model Name/Number, Model Number, Model Series, Mouse, Multi Card Slot, Multi Card Slots, Multimedia Keys, Not Covered in Warranty, Not Covered in Warranty (T & C), Note, Num Of Cells, Number of cells, OS Supported, OVERVIEW, Operating System, Optical Drive, Optical Drive Type, Other Box Contents, Other Ports, Output Volts, Part Number, Period, Pointer Device, Power Supply, Processor Brand, Processor Frequency, Processor Name, Processor Variant, Product Code, Product Depth (cm), Product Features, Product Height (cm), Product Weight (g), Product Width (cm), RAM, RAM Size, RAM Slots, RAM Type, RJ45 LAN, RPM, Read/Write Speed, Resolution, SSD Capacity, Sales Package, Screen Size, Screen Type, Series, Service Type, Size, Sound Effect, Speakers, Speed, Spill-Resistance, Standard Battery, Storage Capacity, Storage Type, Suitable For, Thickness (in mm), Total Keys, Touch Screen, Touchpad, Type, USB 2.0, USB 2.0 Ports, USB 3.0, USB 3.0 Ports, USB 3.1 Ports, USB Port/S, USB Type C Ports, Usage, Utility, VGA, VGA Port, VGA Ports, Variant, Voltage, Warranty, Warranty Period, Warranty Service Type, Warranty Terms, Warranty Type, Webcam, Weight, Weight (in Kg), WiFi, Width, Width (in mm), Wireless LAN, WxDxH, eMMC Capacity
"https://www.snapdeal.com/product/dell-inspiron-3558-notebook-z565155uin9/619612846170#bcrumbSearch:inspiron","Dell Inspiron 3558 Notebook (5th Gen Intel Core i3- 4GB RAM- 1TB HDD- 39.62 cm(15.6)- Ubuntu) (Black)","NA","Rs. 28,974","NA","JE Tech Stores","10% Instant Discount Using HSBC Credit & Debit Cards T&C","Overview","Processor: 5th Gen Intel Core i3-5005U","Memory (RAM): 4 GB","Hard Disk Capacity: 1 TB","Screen Size: 39.62 cm(15.6)","Type: Notebook","https://n2.sdlcdn.com/imgs/b/x/4/Dell-Inspiron-3558-Notebook-Z565155UIN9-SDL074933232-1-751dd.jpg","https://n2.sdlcdn.com/imgs/b/x/4/Dell-Inspiron-3558-Notebook-Z565155UIN9-SDL074933232-2-c59be.jpg","https://n1.sdlcdn.com/imgs/b/x/4/Dell-Inspiron-3558-Notebook-Z565155UIN9-SDL074933232-3-77437.jpg","https://n4.sdlcdn.com/imgs/b/x/4/Dell-Inspiron-3558-Notebook-Z565155UIN9-SDL074933232-4-288a7.jpg","https://n4.sdlcdn.com/imgs/b/x/4/Dell-Inspiron-3558-Notebook-Z565155UIN9-SDL074933232-5-88607.jpg","NA","NA","NA","NA","NA","NA","NA","NA","NA","NA","NA","NA","NA","NA","NA","NA","NA","NA","NA","NA","v4.0","NA","Dell","NA","NA","NA","NA","3 MB","NA","NA","NA","NA","NA","NA","NA","2 GHz","Black","NA","NA","NA","NA","NA","NA","NA","NA","NA","NA","NA","NA","NA","NA","NA","NA","NA","NA","NA","Intel HD","NA","NA","NA","NA","NA","NA","Yes","NA","1 TB","NA","SATA","NA","NA","NA","NA","NA","NA","NA","NA","HD (720p) capable webcam","NA","Yes","NA","Standard Keyboard","NA","No","NA","NA","NA","Kensington Lock Slot","NA","NA","NA","NA","NA","NA","NA","NA","NA","NA","3558","NA","NA","Media Card (SD, SDHC, SDXC)","NA","NA","NA","NA","Please use invoice to register the product on brand website within 30 days of purchase for hassle free service","NA","NA","NA","NA","Ubuntu Linux","Tray load DVD Drive (Reads and Writes to DVD/CD)","NA","NA","NA","NA","NA","NA","Touchpad","NA","Intel","NA","Core i3 (5th Gen)","NA","NA","NA","NA","NA","NA","NA","4 GB DDR3L","NA","NA","NA","NA","5400","8x","1366 x 768 Pixels","NA","Laptop, Battery, AC Adaptor, User Guide and Manuals","39.62 cm (15.6)","Truelife LED-Backlit Display","Inspiron","NA","380 x 260.3 x 21.7 mm","Waves MaxxAudio processing","2 tuned speakers","NA","NA","4-cell Li-ion","NA","NA","NA","NA","NA","NA","NA","Notebook","NA","NA","NA","NA","NA","1 x USB 3.0, 2 x USB 2.0","NA","NA","Everyday Use","NA","NA","NA","5005U","NA","NA","1 Year Dell Onsite Warranty","NA","NA","NA","NA","NA","NA","NA","NA","NA","802.11 b/g/n","NA","NA",
"https://www.snapdeal.com/product/dell-inspiron-15-3542-laptop/243947363#bcrumbSearch:inspiron","Dell Inspiron 15 3542 Laptop (4th Gen Intel Core i3- 4GB RAM- 1TB HDD- 39.62cm (15.6)- Linux) (Black)","NA","Rs. 31,255","NA","JE Tech Stores","10% Instant Discount Using HSBC Credit & Debit Cards T&C","Enhance your daily computing with the Dell Inspiron 15 3542 laptop that is an ideal choice for you. Black in colour, this laptop has a smooth finish and measures 38.1 x 26.7 x 2.56 cm. It has a long battery life that will last you a sufficient period of time without requiring frequent charging even on the go. This laptop has English Non-Backlit Keyboard, a touchpad, 2 tuned speakers and a slim design. The Linux Ubuntu operating system makes it very efficient to use and will not lag.","Memory (Ram) : 4 GB","Screen Size : 39.62cm (15.6)","Hard Disk Capacity : 1 TB HDD","Utility : Entertainment","Operating System : Linux/Ubuntu","https://n1.sdlcdn.com/imgs/a/n/d/Dell-Inspiron-15-3542-Laptop-SDL389269688-2-1e42f.JPG","https://n1.sdlcdn.com/imgs/a/n/d/Dell-Inspiron-15-3542-Laptop-SDL389269688-3-2ff01.JPG","https://n1.sdlcdn.com/imgs/a/n/d/Dell-Inspiron-15-3542-Laptop-SDL389269688-1-59e5e.JPG","NA","NA","NA","NA","NA","NA","NA","NA","NA","NA","NA","NA","NA","NA","NA","Up to 4 hours","NA","NA","NA","NA","NA","NA","v4.0","NA","Dell","NA","NA","NA","NA","3 MB","NA","NA","NA","NA","NA","NA","NA","1.7 GHz","Black","NA","NA","NA","NA","NA","NA","NA","NA","NA","NA","NA","NA","381x267x25.6 mm","NA","NA","NA","Upto 8 GB","NA","NA","Intel HD Graphics 4400","NA","NA","NA","NA","NA","NA","Yes","NA","1 TB HDD","NA","SATA","NA","NA","NA","NA","NA","NA","NA","NA","HD (720p) Capable Webcam","NA","NA","NA","Standard Keyboard","NA","No","NA","NA","NA","Kensington Lock Slot","NA","NA","NA","1 (Unused Slot - 0)","NA","NA","NA","NA","NA","NA","Inspiron 15 3542","NA","NA","Media Card (SD, SDHC, SDXC)","NA","NA","NA","NA","Please use invoice to register the product on brand website within 30 days of purchase for hassle free service","NA","NA","NA","NA","Linux/Ubuntu","Tray-load DVD+/-RW","NA","NA","Security slot","NA","NA","NA","Touchpad","NA","Intel","NA","Core i3 (4th Generation)","NA","NA","NA","NA","NA","NA","NA","4 GB","NA","NA","NA","Yes","5400","8x","1366 x 768 Pixels","NA","Laptop, Battery, AC Adapter, User Guide, Manuals","39.62cm (15.6)","LED Backlit Display with Truelife and HD Resolution","Inspiron 15","NA","NA","Waves MaxxAudio 4","Stereo Speakers","NA","NA","4cells","NA","NA","NA","NA","NA","NA","NA","Notebook","NA","NA","NA","NA","NA","1 x USB 3.0, 2 x USB 2.0","NA","NA","Entertainment","NA","NA","NA","4005U","NA","NA","1 Year Dell Onsite Warranty","NA","NA","NA","NA","2.16 Kg (Approximately)","NA","NA","NA","NA","Dell Wireless-N 1705","NA","NA",
"https://www.snapdeal.com/product/dell-inspiron-3567-notebook-core/663324498652#bcrumbSearch:inspiron","Dell Inspiron 3567 Notebook (7th Gen Intel Core i5- 4GB RAM- 1TB HDD- 39.62cm(15.6)- Ubuntu) (Black)","NA","Rs. 39,699","NA","KHUSHBU ENTERPRISES","10% Instant Discount Using HSBC Credit & Debit Cards T&C","Dell Inspiron 3567 core i5 7th generation 4gb ram/1tb hdd/15.6 /Ubuntu","Warranty Period:1 Year","Usage:Student","Resolution:1366x768 (WXGA)","Base Clock Speed (in GHz):2.5","Backlit Keyboard:No","https://n4.sdlcdn.com/imgs/f/m/e/in3562_3567_3565_lnb_20000f125_bk_2_2-9230f.jpg","https://n4.sdlcdn.com/imgs/f/m/e/in3562_3567_3565_lnb_0045rf110_bk_2_2-018ca.jpg","https://n2.sdlcdn.com/imgs/f/m/e/in3562_3567_3565_lnb_00000t90_bk_2_2-15b92.jpg","https://n4.sdlcdn.com/imgs/f/m/e/cq5dam_web_1280_1280_5-ab442.jpg","NA","NA","NA","NA","NA","NA","NA","NA","NA","NA","NA","NA","No","2.5","Upto 6 hours","NA","4 Cells","NA","Li-ion","NA","NA","v4.0","NA","Dell","3.1","NA","NA","NA","3 MB","NA","NA","NA","NA","NA","NA","NA","NA","Black","NA","NA","NA","NA","NA","Not Applicable","NA","Not Applicable","NA","NA","NA","NA","NA","NA","NA","Upto 1 Gbps","NA","Upto 16 GB","NA","NA","NA","NA","NA","Intel HD Graphics","5400 RPM","NA","Yes","NA","1 TB","NA","NA","NA","Single Combo Jack","NA","Laptop, Battery, Adapter, User Manuals and Invoice","NA","NA","NA","64 bit","NA","NA","Yes","NA","Standard Keyboard with Numpad","NA","No","NA","NA","23.65","Kensington Lock Port","NA","NA","NA","NA","NA","NA","NA","NA","NA","NA","Inspiron 3567","NA","NA","Yes","NA","NA","NA","NA","NA","NA","NA","NA","NA","Linux/Ubuntu","DVD R/W","NA","NA","NA","NA","NA","NA","NA","NA","Intel","NA","Core i5 (7th Generation)","NA","NA","NA","NA","NA","NA","NA","4 GB","NA","2 (Unused - 1)","DDR4","NA","NA","8x","1366x768 (WXGA)","Not Applicable","NA","39.62cm(15.6)","LED","Inspiron","NA","NA","Waves MaxxAudio Pro","2","NA","NA","NA","NA","HDD","NA","260.3","NA","No","Yes","Notebook","NA","1","NA","2","None","NA","None","Student","NA","NA","No","NA","7200","NA","NA","1 Year","NA","NA","Onsite Warranty","1 MP (HD)","NA","2.3","802.11 AC","NA","380","NA","NA","Not Applicable",
"https://www.snapdeal.com/product/dell-inspiron-15-5559-notebook/622866482120#bcrumbSearch:inspiron","Dell Inspiron 5559 Notebook (6th Gen Intel Core i3- 4GB RAM- 1TB HDD- 39.62cm (15.6)- DOS) (Silver)","NA","Rs. 32,538","NA","It Store","10% Instant Discount Using HSBC Credit & Debit Cards T&C","Enjoy the ultimate lag free performance with the all new Dell Inspiron 15 5559 Laptop. Featuring 6th Gen Intel Core i3 6100U, this laptop will deliver a high speed. Now run multiple applications without a glitch owing to the 4 GB RAM. You can even watch videos, movies and play high quality games as this laptop comes with a screen that is HD and widescreen with LED Backlit that will lend you a crisp quality picture. Get the ultimate experience while video calling with dual array digital microphone. The studio quality audio offers rich entertainment experience and will let you enjoy high quality sound output like never before. This laptop appears with a brilliant 39.62 cm full HD display. Even under bright light conditions, you can operate this laptop without any hassle. Another important feature of this laptop is that it can be connected to multiple devices with two USB 2.0 ports and one USB 3.0 port. It runs on Windows 10 Home which is pre installed in this device and is an ideal laptop for daily users.","Warranty Period:1 Year","Usage:Gaming","Resolution:1366x768 (WXGA)","Base Clock Speed (in GHz):2.3","Backlit Keyboard:No","https://n1.sdlcdn.com/imgs/c/x/p/Dell-Inspiron-15-5559-Notebook-SDL280004904-1-72a0b.jpg","https://n1.sdlcdn.com/imgs/c/x/p/Dell-Inspiron-15-5559-Notebook-SDL280004904-2-f37d1.jpg","https://n2.sdlcdn.com/imgs/c/x/p/Dell-Inspiron-15-5559-Notebook-SDL280004904-3-472db.jpg","https://n1.sdlcdn.com/imgs/c/x/p/Dell-Inspiron-15-5559-Notebook-SDL280004904-4-0d7fd.jpg","NA","NA","NA","NA","NA","NA","NA","NA","NA","NA","16:9","NA","No","2.3","Upto 6 hours","NA","4 Cells","NA","Li-ion","NA","NA","v4.0","NA","Dell","2.3","NA","NA","NA","3 MB","NA","NA","NA","NA","NA","NA","NA","NA","Silver","NA","NA","NA","NA","NA","Not Applicable","NA","Not Available","NA","NA","NA","NA","NA","NA","NA","Upto 100 Mbps","NA","Not Applicable","NA","NA","NA","NA","NA","Intel HD Graphics","5400 RPM","NA","Yes","NA","1 TB","NA","NA","NA","Single Combo Jack","NA","Laptop, Battery, AC Adaptor, User Guide and Manuals","NA","NA","NA","64 bit","NA","NA","Yes","NA","Standard Keyboard with Numpad","NA","No","NA","NA","260.4","Kensington Lock Slot","NA","NA","NA","NA","NA","NA","NA","NA","NA","NA","5559","NA","NA","Yes","NA","NA","NA","NA","NA","NA","NA","NA","NA","DOS","DVD R/W","NA","NA","NA","NA","NA","NA","NA","NA","Intel","NA","Core i3 (6th Generation)","NA","NA","NA","NA","NA","NA","NA","4 GB","NA","1 (Unused - 0)","DDR3","NA","NA","8x","1366x768 (WXGA)","Not Applicable","NA","39.62cm(15.6)","Truelife LED-Backlit","Inspiron","NA","NA","Waves MaxxAudio","Integrated speakers","NA","NA","NA","NA","HDD","NA","23.75","NA","No","Yes","Notebook","NA","2","NA","1","None","NA","None","Everyday Use","NA","NA","No","NA","6100U","NA","NA","1 Year","NA","NA","Onsite Warranty","1.3 MP (HD)","NA","2.3","802.11ac","NA","380","NA","NA","Not Applicable",
"https://www.snapdeal.com/product/dell-inspiron-inspiron-15-5559/673684942954#bcrumbSearch:inspiron","Dell Inspiron 5559 Notebook (6th Gen Intel Core i3- 4GB RAM- 1TB HDD- 39.62cm (15.6)- DOS) (Glossy Black)","NA","Rs. 30,713","NA","It Store","10% Instant Discount Using HSBC Credit & Debit Cards T&C","","Warranty Period:1 Year","Usage:Business","Resolution:1366x768 (WXGA)","Base Clock Speed (in GHz):2.3","Backlit Keyboard:No","https://n3.sdlcdn.com/imgs/c/x/u/SDL610245389_1-7764e.jpg","https://n3.sdlcdn.com/imgs/c/y/t/5-fc5fe.jpg","https://n4.sdlcdn.com/imgs/c/y/t/2-8c55f.jpg","https://n2.sdlcdn.com/imgs/c/y/t/3-9ac45.jpg","https://n4.sdlcdn.com/imgs/c/y/t/4-4b5ff.jpg","NA","NA","NA","NA","NA","NA","NA","NA","NA","NA","NA","No","2.3","Upto 6 hours","NA","4 Cells","NA","Li-ion","NA","NA","v4.0","NA","Dell","2.3","NA","NA","NA","3MB","NA","NA","NA","NA","NA","NA","NA","NA","Glossy Black","NA","NA","NA","NA","NA","Intel HD Graphics","NA","NA","NA","NA","NA","NA","NA","NA","NA","Upto 100 Mbps","NA","Upto 8 GB","NA","NA","NA","NA","NA","NA","5400 RPM","NA","Yes","NA","1 TB","NA","NA","NA","Single Combo Jack","NA","Laptop, Battery, AC Adaptor, Invoice, User Guide and Manuals","NA","NA","NA","64 bit","NA","NA","Yes","NA","Standard Keyboard with Numpad","NA","No","NA","NA","380","Kensington Lock Slot","NA","NA","NA","NA","NA","NA","NA","NA","NA","NA","Inspiron 15 5559","NA","NA","Yes","NA","NA","NA","NA","NA","NA","NA","NA","NA","Dos","NA","NA","NA","NA","NA","NA","NA","NA","NA","Intel","NA","Core i3 (6th Generation)","NA","NA","NA","NA","NA","NA","NA","4 GB","NA","2 (Unused - 1)","DDR3","NA","NA","NA","1366x768 (WXGA)","Not Applicable","NA","39.62cm(15.6)","HD LED Blacklit","Inspiron","NA","NA","Waves Maxx Audio 4","Yes","NA","NA","NA","NA","HDD","NA","130","NA","No","Yes (with Multi-touch Gesture Support)","Notebook","NA","2","NA","1","None","NA","None","Home","NA","NA","No","NA","6100U","NA","NA","1 Year","NA","NA","Onsite Warranty","Yes","NA","2.36","Yes","NA","410","NA","NA","Not Applicable",
"https://www.snapdeal.com/product/dell-inspiron-3162-notebook-z569102hin9/632572998760#bcrumbSearch:inspiron","Dell Inspiron 3162 Notebook (Intel Celeron- 2GB RAM- 32GB eMMC- 29.46 cm (11.6)- Windows 10) (Blue)","NA","NA","NA","ADV Online","NA","Realize the dream of next generation super-computing with Dell Inspiron 3162 Notebook. Work with excellence and play with enjoyment with this hi-end notebook. The laptop is powered with Intel Celeron processor and a 2 GB RAM and 32GB eMMC to enable effortless processing of high-load of data and generate desired result. It is integrated with Intel HD graphics. Also, the 29.46 cm screen provides crystal clarity in picture. Latest windows 10 operating system is pre-installed to assure that you get the best GUI OS. Further, the innovative design with an attractive blue colour is a blend of utility and style.","NA","NA","NA","NA","NA","https://n2.sdlcdn.com/imgs/c/v/2/Dell_Inspiron_3162_Notebook_Z569106HIN9_SDL085848971_1_e27b8-1a772.jpg","https://n4.sdlcdn.com/imgs/c/v/2/Dell_Inspiron_3162_Notebook_Z569106HIN9_SDL085848971_2_364e5-fd426.jpg","https://n2.sdlcdn.com/imgs/c/v/2/Dell_Inspiron_3162_Notebook_Z569106HIN9_SDL085848971_3_2132a-361e4.jpg","https://n3.sdlcdn.com/imgs/c/v/2/Dell_Inspiron_3162_Notebook_Z569106HIN9_SDL085848971_4_76d8f-7b54c.jpg","NA","NA","NA","NA","NA","NA","NA","NA","NA","NA","NA","NA","NA","NA","NA","NA","NA","NA","NA","NA","NA","v4.0","NA","Dell","NA","NA","NA","NA","2 MB","NA","NA","NA","NA","NA","NA","NA","2.16 GHz","Blue","NA","NA","NA","NA","NA","NA","NA","NA","NA","NA","NA","NA","292 x 196 x 18.45 mm","NA","NA","NA","NA","NA","NA","Intel HD","NA","NA","NA","NA","NA","NA","v1.4a","NA","32 GB eMMC","NA","NA","NA","NA","NA","NA","NA","NA","NA","NA","720 Pixels Webcam","NA","Yes","NA","Standard Keyboard","NA","No","NA","NA","NA","Kensington Lock Slot","NA","NA","NA","NA","NA","NA","NA","NA","NA","NA","Inspiron 3162","NA","NA","Micro SD media Card Reader","NA","NA","NA","NA","Please use invoice to register the product on brand website within 30 days of purchase for hassle free service","NA","NA","NA","NA","Windows 10","No","NA","NA","NA","NA","NA","NA","Touchpad","45 Watt AC Adaptor","Intel","NA","Intel Celeron","NA","NA","NA","NA","NA","NA","NA","2 GB","NA","NA","NA","NA","NA","NA","1366 x 768 pixels","NA","Laptop, Battery, AC Adaptor, User Guide and Manuals","29.46 cm (11.6)","Anti-Glare LED-Backlit Display (HDLCD)","Inspiron","NA","NA","NA","Yes","NA","NA","2-Cell Li-Ion","NA","NA","NA","NA","NA","NA","NA","Notebook","NA","NA","NA","NA","NA","1 x USB 3.0; 2 x USB 2.0","NA","NA","Everyday Use","NA","NA","NA","N3050","NA","NA","1 Year Dell Onsite Warranty","NA","NA","NA","NA","1.18 kg","NA","NA","NA","NA","802.11ac","NA","NA",
"https://www.snapdeal.com/product/dell-inspiron-3567-notebook-core/631625304885#bcrumbSearch:inspiron","Dell Inspiron 3567 Notebook Core i3 (6th Generation) 4 GB 39.62cm(15.6) Hard Disk Capacity 1 TB Black","NA","Rs. 30,500","NA","It Store","10% Instant Discount Using HSBC Credit & Debit Cards T&C","Dell Inspiron 3567 Notebook (6th Gen Interl Core i3- 4GB RAM- 1TB HDD- 39.62cm(15.6) with DOS (Black)","Warranty Period:1 Year","Usage:Home","Resolution:1366x768 (WXGA)","Base Clock Speed (in GHz):2.3","Backlit Keyboard:No","https://n1.sdlcdn.com/imgs/f/p/3/Dell-Inspiron-3567-Notebook-Core-SDL647155085-1-5cd93.jpg","https://n1.sdlcdn.com/imgs/f/p/3/Dell-Inspiron-3567-Notebook-Core-SDL647155085-2-63194.jpg","https://n2.sdlcdn.com/imgs/f/p/3/Dell-Inspiron-3567-Notebook-Core-SDL647155085-3-2c215.jpg","https://n4.sdlcdn.com/imgs/f/p/3/Dell-Inspiron-3567-Notebook-Core-SDL647155085-4-902a4.jpg","https://n2.sdlcdn.com/imgs/f/p/3/Dell-Inspiron-3567-Notebook-Core-SDL647155085-5-9d85c.jpg","NA","NA","NA","NA","NA","NA","NA","NA","NA","NA","NA","No","2.3","Upto 4 hours","NA","4 Cells","NA","Li-ion","NA","NA","v4.2","NA","Dell","2.3","NA","NA","NA","3 MB","NA","NA","NA","NA","NA","NA","NA","NA","Black","NA","NA","NA","NA","NA","Not Applicable","NA","NA","NA","NA","NA","NA","NA","NA","NA","Upto 100 Mbps","NA","Upto 8 GB","NA","NA","NA","NA","NA","NA","5400 RPM","NA","Yes","NA","1 TB","NA","NA","NA","Single Combo Jack","NA","1 Unit Laptop & Charger","NA","NA","NA","64 bit","NA","NA","Yes","NA","Standard Keyboard without Numpad","NA","No","NA","NA","260","Not Available","NA","NA","NA","NA","NA","NA","NA","NA","NA","NA","3567","NA","NA","No","NA","NA","NA","NA","NA","NA","NA","NA","NA","DOS","DVD R/W","NA","NA","NA","NA","NA","NA","NA","NA","Intel","NA","Core i3 (6th Generation)","NA","NA","NA","NA","NA","NA","NA","4 GB","NA","1 (Unused - 0)","DDR4","NA","NA","8x","1366x768 (WXGA)","Not Applicable","NA","39.62cm(15.6)","15.6 Inches","Inspiron","NA","NA","Dolby","2","NA","NA","NA","NA","HDD","NA","23.65","NA","No","Yes (with Multi-touch Gesture Support)","Notebook","NA","1","NA","2","None","NA","3","Home","NA","NA","No","NA","6006U","NA","NA","1 Year","NA","NA","Onsite Warranty","1 MP (HD)","NA","2.3","802.11 ac","NA","380","NA","NA","Not Applicable",
"https://www.snapdeal.com/product/dell-inspiron-inspiron-5567-156/639261376369#bcrumbSearch:inspiron","Dell Inspiron 5567 Notebook (7th Gen Intel i5- 8GB RAM- 1TB HDD- 39.62cm Full HD(15.6)-Win10 with MS Office-4GBGraphics) (Grey)","NA","Rs. 53,990","NA","Kolkata Knight Riders_Voi**","10% Instant Discount Using HSBC Credit & Debit Cards T&C","The images represent actual product though color of the image and product may slightly differ.","Warranty Period:1 Year","Usage:Business","Resolution:1920x1080 (Full HD)","Base Clock Speed (in GHz):2.5","Backlit Keyboard:Yes","https://n2.sdlcdn.com/imgs/f/n/i/Dell-Inspiron-5567-Notebook-7th-SDL303492747-1-83664.jpg","https://n2.sdlcdn.com/imgs/f/n/i/Dell-Inspiron-5567-Notebook-7th-SDL303492747-2-347d8.jpg","https://n3.sdlcdn.com/imgs/f/n/i/Dell-Inspiron-5567-Notebook-7th-SDL303492747-3-b5d3b.jpg","https://n3.sdlcdn.com/imgs/f/n/i/Dell-Inspiron-5567-Notebook-7th-SDL303492747-4-a5960.jpg","https://n1.sdlcdn.com/imgs/f/n/i/Dell-Inspiron-5567-Notebook-7th-SDL303492747-5-827c6.jpg","NA","NA","NA","NA","NA","NA","NA","NA","NA","NA","NA","Yes","2.5","Upto 6 hours","NA","3 Cells","NA","Li-ion","NA","NA","v4.0","NA","Dell","3.1","NA","NA","NA","3 MB","NA","NA","NA","NA","NA","NA","NA","NA","Grey","NA","NA","NA","NA","NA","4 GB","NA","NA","NA","NA","NA","NA","NA","NA","NA","Upto 100 Mbps","NA","Upto 8 GB","NA","NA","NA","NA","NA","NA","7200 RPM","NA","Yes","NA","1 TB","NA","NA","NA","Single Combo Jack","NA","Laptop, Battery, AC Adaptor, User Guide and Manuals","NA","NA","NA","64 bit","NA","NA","Yes","NA","Standard Keyboard with Numpad","NA","No","NA","NA","259","Kensington Lock Slot","NA","NA","NA","NA","NA","NA","NA","NA","NA","NA","Inspiron 5567","NA","NA","No","NA","NA","NA","NA","NA","NA","NA","NA","NA","Windows 10 Home with MS Office Home & Student","NA","NA","NA","NA","NA","NA","NA","NA","NA","Intel","NA","Core i5 (7th Generation)","NA","NA","NA","NA","NA","NA","NA","8 GB","NA","1 (Unused - 0)","DDR4","NA","NA","NA","1920x1080 (Full HD)","Not Applicable","NA","39.62cm(15.6)","Full HD Antiglare","Inspiron","NA","NA","Waves Mex Audio pro","Yes","NA","NA","NA","NA","HDD","NA","33.3","NA","No","Yes (with Multi-touch Gesture Support)","Notebook","NA","2","NA","1","None","NA","None","Business","NA","NA","Yes","NA","7200","NA","NA","1 Year","NA","NA","Onsite Warranty","1 MP (HD)","NA","2.3","Yes","NA","390","NA","NA","Not Applicable",
"https://www.snapdeal.com/product/dell-inspiron-inspiron-15-5559/619745997404#bcrumbSearch:inspiron","Dell Inspiron 5559 Notebook (6th Gen Intel Core i3- 4GB RAM- 1TB HDD- 39.62cm(15.6)- Win 10 with MS Office) (Black)","NA","Rs. 36,481","NA","JE Tech Stores","10% Instant Discount Using HSBC Credit & Debit Cards T&C","","Processor: 6th Gen Intel Core i3-6100U","Memory (RAM): 4 GB","Hard Disk Capacity: 1 TB","Screen Size: 39.62 cm(15.6)","Type: Notebook","https://n3.sdlcdn.com/imgs/c/x/q/SDL945119005_1_09046-d08ef.jpg","https://n4.sdlcdn.com/imgs/c/x/q/SDL945119005_2_0d721-40e63.jpg","https://n2.sdlcdn.com/imgs/c/x/q/SDL945119005_3_9df64-436ab.jpg","https://n2.sdlcdn.com/imgs/c/x/q/SDL945119005_4_b5973-17ffd.jpg","https://n1.sdlcdn.com/imgs/c/x/q/SDL945119005_5_c927d-72604.jpg","NA","NA","NA","NA","NA","NA","NA","NA","NA","NA","NA","No","2.3","Upto 6 hours","NA","4 Cells","NA","Li-ion","NA","NA","v4.0","NA","Dell","2.3","NA","NA","NA","3 MB","NA","NA","NA","NA","NA","NA","Intel","NA","Black","NA","NA","NA","NA","NA","Not Applicable","NA","Not Applicable","NA","NA","NA","NA","NA","NA","NA","Upto 1 Gbps","NA","Upto 16 GB","NA","NA","NA","NA","NA","Intel HD Graphics","5400 RPM","NA","Yes","NA","1TB","NA","NA","NA","Single Combo Jack","NA","Laptop, Battery, Adapter, User Manuals and Invoice","NA","NA","NA","64 bit","NA","NA","Yes","NA","Standard Keyboard with Numpad","NA","No","NA","NA","390","Kensington Lock Slot","NA","NA","NA","NA","NA","NA","NA","NA","NA","NA","Inspiron 5559","NA","NA","Yes","NA","NA","NA","NA","NA","NA","NA","NA","NA","Windows 10 Home with Microsoft Office Home and Student","NA","NA","NA","NA","NA","NA","NA","NA","NA","Intel","NA","Core i3 (6th Generation)","NA","NA","NA","NA","NA","NA","NA","4 GB","NA","2 (Unused - 1)","DDR3","NA","NA","NA","1366x768 (WXGA)","Not Applicable","NA","39.62cm(15.6)","HD LED Backlit","Inspiron","NA","NA","waves maxx audio 4","2","NA","NA","NA","NA","HDD","NA","35","NA","No","Yes (with Multi-touch Gesture Support)","Notebook","NA","1","NA","2","None","NA","None","Home","NA","NA","No","NA","6100U","NA","NA","1 Year","NA","NA","Onsite Warranty","0.3 MP (VGA)","NA","2.36","Yes","NA","150","NA","NA","Not Applicable",
