MoonBoy Seller Name,MoonBoy SKU,MoonBoy Category,MoonBoy Attribute Set,MoonBoy Product Name,Moonboy.in Link,MoonBoy MRP,MoonBoy Price,MoonBoy Shipping,MoonBoy Seller,MoonBoy Promo
 B.J.Infotech,,,,Ambrane Power Bank P-1333 13000mAh,https://www.moonboy.in/ambrane-power-bank-p-1333-13000mah/553428/ZYUE-413-P-1333Black,,,,,
 Smartserve Houseware Pvt Ltd,,,,Bohemia crystal Sandra hi ball glass (380ml) set of 6 pcs,https://www.moonboy.in/bohemia-crystal-sandra-hi-ball-glass-(380ml)-set-of-6-pcs/552846/JOQB-534-SS22017,,,,,
Blur Flame,,,,Plumeria V Salad Bowl With Coner Handles-MED,https://www.moonboy.in/plumeria-v-salad-bowl-with-coner-handles-med/664526/QCLE-455-CB2409-34-R343,,,,,
sheela Enterprises,,,,WOAKERS Men's Elara Lace Up IDP Navy Blue Synthetic Leather Sneakers,https://www.moonboy.in/woakers-men's-elara-lace-up-idp-navy-blue-synthetic-leather-sneakers/638929/HOXA-675-WK-1117-navy-8,,,,,
Good Life Stuff,,,,Good Life Stuff Genuine Leather Wallet for Men in Black,https://www.moonboy.in/good-life-stuff-genuine-leather-wallet-for-men-in-black/651833/OZDB-404-GLSWL-A011,,,,,
Kataria Jewellers ,,,,Kataria Jewellers The Terceira Silver Swarovski Bis Hallmarked Earrings,https://www.moonboy.in/kataria-jewellers-the-terceira-silver-swarovski-bis-hallmarked-earrings/635442/WCXU-642-pk19jl129,,,,,
KDM Sports Pvt Ltd,,,,KDM Sports Football,https://www.moonboy.in/kdm-sports-football/638766/PCXU-470-KDM-CY20,,,,,
